start	end	text
2312000	2314000	3日の日にリアルコラボしましょう
2314000	2316000	3日の日に何コラボ
2316000	2318000	リアルコラボ
2318000	2320000	負けたら
2320000	2322000	忍法さんが負けたら
2322000	2324000	忍法さんが負けたらなしってこと
2324000	2326000	ハロウィンギフト来たありがとうございます
2326000	2328000	11号ちゃん助けて
2328000	2330000	11号ちゃん助けて
2330000	2332000	11号ちゃんちょっと助けて
2332000	2334000	リアルコラボする
2334000	2336000	私千葉行くんで
2336000	2338000	でも僕ニコラムでやっていい?
2338000	2340000	やっていいですよ
2340000	2342000	ファッチで外配信ってちょっと不安だから
2342000	2344000	ファッチってそういうとこ厳しいんですよ
2344000	2346000	ワガ君は絶対的に圧倒的だ
2346000	2348000	外配信なんですか
2348000	2350000	外配信なんですか
2350000	2352000	じゃあ何配信なの?うちに来るとか
2352000	2354000	家に誰かいるんですか
2354000	2356000	僕一人暮らし
2356000	2358000	じゃあいいじゃないですか
2358000	2360000	めちゃくちゃ汚いよ
2360000	2362000	掃除しますよ
2362000	2364000	みんな
2364000	2366000	ギフトこじきしちゃダメなんだって
2366000	2368000	警察に聞いたら
2368000	2370000	そんなことないですよ
2370000	2372000	ギフトくれっていうのは
2372000	2374000	固じき行為で刑犯罪法違反だから
2374000	2376000	やめてくださいって言われたんだけど
2376000	2378000	そうなんですか
2378000	2380000	そういうこと言っちゃいけない
2380000	2382000	ギフト頼むはダメだけど
2382000	2384000	頼むだけならOK
2384000	2386000	みんな俺のために頼む
2386000	2388000	ありがとうございます
2388000	2390000	ワガ君は
2390000	2392000	いいねありがとう
2392000	2394000	みんなちゃんちゃん頼むよ
2394000	2396000	ありがとう
2396000	2398000	ハルって言うんだよね
2398000	2400000	ワガ君は圧倒的だ
2400000	2402000	誰か助けて
2402000	2404000	生主さんらしい
2404000	2406000	生主さんらしいです
2406000	2408000	みんなワガ君は圧倒的だ
2408000	2410000	僕は負けたら何にする?
2410000	2412000	負けたらコラボなし
2412000	2414000	負けたらコラボなし
2414000	2416000	勝ったらコラボあり
2416000	2418000	勝ったらコラボあり
2418000	2420000	しばいきます
2420000	2422000	11月3日
2422000	2424000	予定見る?
2424000	2426000	大丈夫
2426000	2428000	みんなギフト頼む
2428000	2430000	これ言っちゃダメなんだ
2430000	2432000	みんな
2432000	2434000	俺に力を
2434000	2436000	粘着するんですか
2436000	2438000	忍法さん
2438000	2440000	みんな俺に力を分けてくれ
2440000	2442000	忍法さん
2442000	2444000	親を殴ってる
2444000	2446000	よくありがとう
2446000	2448000	待って負けちゃう
2448000	2450000	花火きた
2450000	2452000	ありがとうございます
2452000	2454000	応援花火ありがとうございます
2454000	2456000	ワガ君は圧倒的だ
2456000	2458000	すみませんお願いします
2458000	2460000	すみませんお願いします
2460000	2462000	待ってあと20秒
2462000	2464000	助けて誰か
2464000	2466000	ワガ君は圧倒的であります
2466000	2468000	これは戦略と戦術と
2468000	2470000	戦略戦術
2470000	2472000	戦法
2472000	2474000	僕は今勝ってる
2474000	2476000	終わった終わった
2476000	2478000	待って待って
2478000	2480000	勝ちました
2480000	2482000	勝ちました
2482000	2484000	自分顔が可愛い
2484000	2486000	デート決定
2486000	2488000	勝ちました
2488000	2490000	じゃあコラボするか
2490000	2492000	いいですよコラボ
2492000	2494000	うちってかなり
2494000	2496000	アクセス悪いけど大丈夫
2496000	2498000	アクセスって何ですか
2498000	2500000	難しいですか
2500000	2502000	バス行かなきゃいけないから
2502000	2504000	それとも外でコラボする?
2504000	2506000	例えば
2506000	2508000	お店とか
2508000	2510000	お店ってダメなんだ
2510000	2512000	許可問えばいいんだけど
2512000	2514000	宿転とかあったら
2514000	2516000	ちょっとめんどくさい
2516000	2518000	ハーニングするから
2518000	2520000	イヤホン買ってください
2520000	2522000	イヤホン
2522000	2524000	イヤホンジャックって何か
2524000	2526000	イヤホンはそのうち買っとくよ
2526000	2528000	イヤホンジャックがないかもしれない
2528000	2530000	ちょっと待って
2530000	2532000	イヤホンジャック見る?
2534000	2536000	イヤホンジャックないわ
2536000	2538000	あるかな
2538000	2540000	イヤホンジャック4つある
2540000	2542000	ありすぎじゃない
2542000	2544000	イヤホンジャックあるから
2544000	2546000	家にテレビってあるんですか
2546000	2548000	だから受信料払わないでOK
2548000	2550000	NHKの
2552000	2554000	でも電子機器持ってたら
2554000	2556000	一緒ですよ
2556000	2558000	電子機器とか
2558000	2560000	何もない
2560000	2562000	じゃあ今どうやって配信してるんですか
2562000	2564000	テレビは映らない
2564000	2566000	テレビ映らないから大丈夫
2566000	2568000	テレビある
2568000	2570000	コラボするか
2570000	2572000	3日の日?
2572000	2574000	3日お願いします
2574000	2576000	DMください
2576000	2578000	DMください
2578000	2580000	ツイッター調べる?
2580000	2582000	ツイッター付く日にあります
2582000	2584000	チボッキって何ですか
2584000	2586000	チボッキって何ですか
2586000	2588000	チボッキって何?
2588000	2590000	ニッポさん
2590000	2592000	顔悪くないよね
2592000	2594000	メガネ外してください
2594000	2596000	メガネ外したほうがいい
2596000	2598000	メガネ外したほうがいい
2598000	2600000	外したほうがいい
2600000	2602000	外したらさ僕
2602000	2604000	個性がなくなるじゃん
2604000	2606000	いじる場所が
2606000	2608000	個性なくなるから
2608000	2610000	鎖病なんですか
2610000	2612000	ちゃんと精神化であれして
2612000	2614000	あれしてるから
2614000	2616000	売名じゃないです
2616000	2618000	じゃあコラボしようぜ
2618000	2620000	昨日本当に私心配だったんですよ
2620000	2622000	本当に私心配だったんですよ
2622000	2624000	ツイッターに
2624000	2626000	僕面部屋だから
2626000	2628000	そういうふうになっちゃうんだよねたまに
2628000	2630000	面部屋だから
2630000	2632000	そういうことはないようにするから
2632000	2634000	正直僕のこと今
2634000	2636000	好印象
2636000	2638000	好印象っていうか
2638000	2640000	ちょっとして心配
2640000	2642000	ありがとう
2642000	2644000	心配か
2644000	2646000	金曜日何時頃コラボする?
2646000	2648000	僕超朝型なんだけど
2648000	2650000	じゃあ朝から行きますよ
2650000	2652000	分かった
2652000	2654000	教われる
2654000	2656000	教わったりしないよ
2656000	2658000	私は売名じゃないよ
2658000	2660000	僕なんか深っちゃってまだ3日とかそれくらいだもん
2660000	2662000	ブロンズですか
2662000	2664000	ブロンズAで5位になって
2664000	2666000	こうやってすごい
2666000	2668000	すごいと思います
2668000	2670000	だってまだ3日目
2670000	2672000	3日ぐらい
2672000	2674000	ニコ生での実績があるからね
2674000	2676000	そうですね
2676000	2678000	昨日の配信上がってる
2678000	2680000	昨日の配信上がってる
2680000	2682000	youtubeに
2682000	2684000	じゃあ金曜日
2684000	2686000	そうですね
2686000	2688000	また泳い
2688000	2690000	よろしくお願いします
2692000	2694000	なんも反応がなかった
2700000	2702000	鼻の下伸ばしてないよ
2714000	2716000	鼻の下伸ばしてないよ
2722000	2724000	イヤホン買う
2724000	2726000	実家にあると思う
2726000	2728000	実家の引き出しに
2728000	2730000	多分イヤホンあるからそれを
2730000	2732000	持ってきてもらおうかな
2732000	2734000	長さ足りるかな
2734000	2736000	ここからここまで
2736000	2738000	あ、イヤホンジャック
2738000	2740000	ここにあった
2740000	2742000	長さ足りるわ
2742000	2744000	出会い行為じゃないよ
2744000	2746000	コラボだよ
2746000	2748000	出会い行為じゃなくてコラボだから
2748000	2750000	コラボレーション
2750000	2752000	これ出会いとかじゃなくて
2752000	2754000	コラボするだけだから
2754000	2756000	コラボはコラボ
2756000	2758000	配信所同士コラボしましょうっていう
2758000	2760000	そういうことやでしょ
2760000	2762000	フワッチバンとかならないよ
2762000	2764000	記憶ありがとう
2766000	2768000	僕これから不安主としてやっていくから
2768000	2770000	フワッチ主と
2770000	2772000	どんどんコラボしていくわ
2772000	2774000	フワッチ主と
2774000	2776000	不安主とをどんどんコラボしていく
2776000	2778000	記憶ありがとう
2780000	2782000	ボットンさんはもうデカくなりすぎちゃったから
2782000	2784000	コラボしてもらえないと思う
2784000	2786000	ボットンさんは
2786000	2788000	裏庁会議で
2788000	2790000	やってそれで
2790000	2792000	コラボったけどさすがにデカくなりすぎちゃった
2792000	2794000	もうコラボしてくれない
2794000	2796000	YouTubeで
2796000	2798000	登録ニーズ
2798000	2800000	10万とか20万とかでしょ
2800000	2802000	さすがに
2802000	2804000	無理だわ
2804000	2806000	出会い系じゃないか
2806000	2808000	でも僕が言ったじゃん
2808000	2810000	幸せにしたい人がいるって
2810000	2812000	幸せにしたい人がいるって言ったじゃん
2812000	2814000	でもその人は幸せにはしたいけど
2814000	2816000	僕じゃ無理
2816000	2818000	僕はレペゼン
2818000	2820000	フォックスとコラボしたからね
2820000	2822000	それの実績あるからね
2822000	2824000	さっきはギフトありがとう
2824000	2826000	おかげで勝てたわ
2826000	2828000	今ギフトいくらだろう
2828000	2830000	882ポイントだ
2836000	2838000	昨日ゼロワン怒ってたから
2838000	2840000	フワッチ舐めやがって
2840000	2842000	誰ゼロワンって
2842000	2844000	知らん人なんだけど
2844000	2846000	今日は作業じゃない
2846000	2848000	ゼロワンって名前だけ
2848000	2850000	なんか聞いたことあるような気がするけど
2850000	2852000	どういう人か知らん
2852000	2854000	どういう人か知らんね
2862000	2864000	さっき最後に愛してるって言ったのは
2864000	2866000	冗談だよ
2866000	2868000	ひとつの冗談だよ
2870000	2872000	ゼロワンって名前だけなんか
2872000	2874000	聞いたことあるけど
2874000	2876000	知らん
2876000	2878000	よっさんより圧倒的に上の人だよ
2878000	2880000	そんな人がいるの
2880000	2882000	じゃあ僕も挨拶したほうがいいかな
2882000	2884000	ゼロワンさん
2884000	2886000	初めましてニコ生の忍法と言います
2886000	2888000	わけあって
2888000	2890000	3日ぐらい前から
2890000	2892000	フワッチ来たんでよろしくお願いします
2892000	2894000	ゼロワンさんよかったら仲良くしてください
2894000	2896000	ゼロワンさん相手にされません
2896000	2898000	わけあって
2898000	2900000	ニコ生が荒れまくって
2900000	2902000	パルパルにも挨拶
2902000	2904000	パルパルは知ってる
2904000	2906000	配信業界のニュースとか取り上げてる
2906000	2908000	ちょっと太ったおじさんでしょ
2908000	2910000	パルパルさん
2910000	2912000	パルパルさんは知ってる
2912000	2914000	かやくだるも知ってる
2914000	2916000	あの人もともとニコ生で
2916000	2918000	かやくだるFXって言って
2918000	2920000	FXで名を馳せてたから
2920000	2922000	俺FX配信者見てたんで
2922000	2924000	パンコさんとかかやくだるさんとか
2924000	2926000	いろいろ見てたから
2926000	2928000	みやはるひとか見てたから
2928000	2930000	イノシシも挨拶してよって
2930000	2932000	あいつニコ生じゃねえかい
2932000	2934000	ゼロワンTikTokで配信して10日で
2934000	2936000	7500万稼いでた
2936000	2938000	めちゃくちゃだな
2938000	2940000	そんな人がいるの
2940000	2942000	ゼロワンさんって俺顔も知らないけど
2942000	2944000	名前だけなんかぼんやり聞いたことあるけど
2944000	2946000	2ヶ月で人気投票1位だよTikTokでも
2946000	2948000	すげえな
2948000	2950000	俺もそうなりたいわ
2950000	2952000	俺も配信で頑張って
2952000	2954000	俺さフワッチで頑張れば
2954000	2956000	1000万いけると思う
2956000	2958000	フワッチで頑張れば年収1000万いけると思う
2958000	2960000	エスヤーカも追放される怖いとこやぞ
2960000	2962000	エスヤーカさんって昔いたね
2962000	2964000	ニコ生で
2964000	2966000	何か床屋配信とかしてた人
2966000	2968000	散歩配信とか
2970000	2972000	エスヤーカさんがもう追い出されちゃったの
2976000	2978000	ゼロワンは月収で1000万超えるけど
2978000	2980000	マジか
2980000	2982000	森がディスってる
2982000	2984000	僕ニコ生にはもう帰りたくない
2984000	2986000	当たりがきついんだ
2986000	2988000	僕ね
2988000	2990000	野田は
2990000	2992000	ツイキャスじゃん
2994000	2996000	ビッグニートに挨拶しろ
2996000	2998000	ビッグニートもさ
2998000	3000000	ニコ生の人じゃん
3000000	3002000	年収1000万
3002000	3004000	超えたいよ
3004000	3006000	年収1000万超えたら
3006000	3008000	僕は普通に結婚できる
3008000	3010000	でも僕朝って元気なんだよね
3010000	3012000	でもさ
3012000	3014000	朝元気でもどんどん落ちていっちゃう
3014000	3016000	朝元気でも
3016000	3018000	気分がどんどん落ちていっちゃう
3018000	3020000	それをなんとかしないと
3020000	3022000	評価ありがと
3022000	3024000	これどうしたらいいんだろう
3024000	3026000	俺ってどうしたらいいと思う
3026000	3028000	フラッチでも
3028000	3030000	脱が上がらないし
3030000	3032000	前の配信内容の中身がねえんだよ
3032000	3034000	なんでそういうこと言うの
3034000	3036000	フレームやめたほうがいい
3036000	3038000	じゃあフレームやめるよ
3038000	3040000	フレームなし
3040000	3042000	このほうがいい
3042000	3044000	このほうがスッキリして見えるね
3044000	3046000	フラッチのことをもっと勉強しなさい
3052000	3054000	あ、ハンバーガーじゃない
3054000	3056000	また間違えた
3056000	3058000	ハンバーガーのアイコンしてる人が
3058000	3060000	ヒヨコ投げてくれたのに
3060000	3062000	ハンバーガーのアイコンだからハンバーガー投げてくれたと思って
3062000	3064000	ぬか喜びしちゃった
3064000	3066000	バカポテありがとう
3066000	3068000	元気出したいな俺
3068000	3070000	元気出したいな
3070000	3072000	なんか俺さ
3072000	3074000	いっぱいいっぱいになると
3074000	3076000	超絶あれになっちゃうんだよね
3076000	3078000	おかせてありがとう
3078000	3080000	DM読んだよ
3080000	3082000	ざっくり
3084000	3086000	ヒヨコありがとう
3092000	3094000	コラボって何すんだろう
3096000	3098000	コラボって何すんだろう
3098000	3100000	具体的に
3100000	3102000	ただこうやってお話するだけかな
3102000	3104000	30分ぐらい
3104000	3106000	じゃあよろしくねって何
3106000	3108000	ちょっとDMO
3108000	3110000	サラッとしか読んでないか
3110000	3112000	わかんないんだよよろしくとか言われても
3122000	3124000	フラッチは動きやないと
3124000	3126000	すぐ飽きられるよ
3134000	3136000	まあこれからは僕は
3136000	3138000	フラッチ配信者として頑張っていきます
3140000	3142000	ワンワン来た
3142000	3144000	ワンワンって誰
3144000	3146000	ワンワンも知ってるよ
3146000	3148000	サラッとコラボしてた人でしょ
3148000	3150000	mening
3152000	3154000	人どんどん増えてくる
3154000	3156000	なんかねコメント欄がまたバグってきた
3156000	3158000	コメント欄がバグってくるの
3158000	3160000	コメント欄がバグってきて
3160000	3162000	またコメント欄
3162000	3164000	コメントは見えなくなってきてる
3164000	3165580	新しいコメントがあります
3165580	3167140	チェックしてもまたコメントは
3167200	3168840	どんどん下がってきちゃって
3168840	3170840	コメントは見えなくなる
3170840	3172840	じゃあコメント無しで喋れってことを
3172840	3174840	コメント無しで喋れってことを
3174840	3176840	俺はパートナーが欲しい
3176840	3178840	パトナーを作る。あ、読み上げつければいいんだ。
3178840	3180840	最近の恋愛事情はどうよ?
3180840	3182840	最近の恋愛事情?
3182840	3184840	最近の恋愛事情は
3188840	3190840	最近の恋愛事情は
3190840	3192840	全くないよ
3192840	3194840	全くない
3194840	3196840	ちょっと告白したけど、振られたぐらい
3202840	3204840	パソコンだとバグ出るの?
3204840	3206840	アシオカリアト
3210840	3212840	兄様イケメンチュッチュ
3212840	3214840	チュッチュッチュ
3214840	3216840	チュッチュッチュッチュ
3218840	3220840	あ、高熱費自分で払ってる
3220840	3222840	えらいでしょ、俺
3222840	3224840	水道高熱費
3224840	3226840	食費
3226840	3228840	健康保険料
3228840	3230840	収入税
3230840	3232840	全部自分で払ってます
3232840	3234840	親から仕送り
3234840	3236840	送ってもらってるけど
3240840	3242840	読み上げうるさい
3242840	3244840	だってそうしないとさ
3246840	3248840	読み上げうるさい
3248840	3250840	でもさ、これ
3250840	3252840	ダメなんだもん
3252840	3254840	コメントが、ちゃんと
3254840	3256840	新しいコメントが出てこないの
3256840	3258840	バグってるわ、もう
3258840	3260840	ふわっち、ふわっち運営さん
3260840	3262840	作れよ
3262840	3264840	ふわっち運営さんがしっかりしてくれなかった
3264840	3266840	僕はもうやめるよ
3268840	3270840	スマホでコメント見えない
3270840	3272840	スマホにアプリ入れてないもん、ふわっちの
3272840	3274840	リン様素敵ありがとう
3274840	3276840	あ、治ったかもしんない、記憶ありがとう
3276840	3278840	僕、ふわっちから追い出されたら
3278840	3280840	もう本当に
3280840	3282840	配信するとこなくなっちゃう、ツイッチぐらいしか
3282840	3284840	ツイッチって外資の企業でしょ
3284840	3286840	だから、ちょっと不安っていうのもある
3286840	3288840	ツイッチは外資の企業だから
3288840	3290840	ツイッチやったほうがいいかな
3290840	3292840	でも、ツイッチは多分やらないと思う
3292840	3294840	が、外資だから、YouTubeもしない
3294840	3296840	だから僕は、ふわっちとニコ生
3296840	3298840	だけでやってく
3298840	3300840	ふわっちとニコ生だけで
3300840	3302840	177なんかそんなマイナーなところいかないよ
3302840	3304840	177って
3308840	3310840	177ってマイナーなところはいかないよ
3310840	3312840	TikTokか
3312840	3314840	ね、そ、ゼロワンって
3314840	3316840	人調べていい?ど、どんな人なんだろう
3316840	3318840	どういう人が人気なんだろう
3318840	3320840	ふわっちゼロワンで出てくる
3320840	3322840	ふわっち
3322840	3324840	ゼロワン
3326840	3328840	画像検索
3332840	3334840	なんか
3334840	3336840	いかついな
3336840	3338840	この人、え、いかついんだけど
3342840	3344840	い、いかついんだけど
3344840	3346840	こういう人が人気なの
3366840	3368840	な、なんかちょっとこ、こ、こわもてな感じだね
3370840	3372840	い、いかつい感じで
3374840	3376840	いかつい感じでこわもてな感じだね
3384840	3386840	こういう人が人気なんだ
3392840	3394840	いや、ちょ、ちょっとビビった
3396840	3398840	ちょ、ちょっとビビった
3398840	3400840	ゼ、ゼロワンさん
3400840	3402840	いかつい感じの
3402840	3404840	いかつい感じの
3404840	3406840	こういう人が人気なんだ
3406840	3408840	え、じゃあさ
3408840	3410840	俺みたいな弱者男性は
3410840	3412840	人気出ないってこと
3412840	3414840	僕みたいな弱者男性は人気出ないってこと
3414840	3416840	弱者男性
3416840	3418840	え、180cm以上あるのゼロワンさん
3418840	3420840	あの用紙で180とかあったらもう
3420840	3422840	無理じゃん
3422840	3424840	うどん検査ありがとう
3424840	3426840	弱者はニコ生でしか人気は出ない
3428840	3430840	元格闘家なんだ
3430840	3432840	ちょっと怖そうな人でビビった
3436840	3438840	あなた大人気だよ、どこだよ来たの
3438840	3440840	ニコ生から来ました
3440840	3442840	ニコ生の忍法です
3442840	3444840	暴走族総長
3444840	3446840	怖いな、ふわっちってなんか
3450840	3452840	ふわっち怖い人しかいないな
3460840	3462840	僕はいつか
3462840	3464840	あなたの恋人
3464840	3466840	になりたい
3466840	3468840	あのね
3468840	3470840	でも恋をしているよ
3470840	3472840	あ、ワインありがとう
3472840	3474840	僕だってね
3474840	3476840	僕と振り回すよ、僕と持って
3476840	3478840	きえ、きえ、きえい
3478840	3480840	ってやって、僕と振り回すよ
3480840	3482840	黒猫とは付き合わない
3482840	3484840	黒猫とは付き合わない
3484840	3486840	ハロウィン渋谷行かないの
3486840	3488840	行かないね
3490840	3492840	行くイノックスはあるよ
3494840	3496840	だって、コスプレ
3496840	3498840	持ってないもん
3498840	3500840	ワインケピありがとう
3510840	3512840	ポンちゃんと行かない
3520840	3522840	どうしよう
3524840	3526840	あ、母ちゃんから
3526840	3528840	ラインだ
3532840	3534840	今母ちゃんに会う気
3534840	3536840	しないんだよな
3550840	3552840	俺さ
3552840	3554840	ガチで
3558840	3560840	いや、すごい
3560840	3562840	悩んでんの今
3564840	3566840	僕さ
3566840	3568840	すごい悩んでるの
3572840	3574840	僕の推しね
3574840	3576840	推し
3576840	3578840	好きな人とは言わない
3578840	3580840	推しの人が
3582840	3584840	苦しんでるんだよ
3584840	3586840	推しの人が
3590840	3592840	怖い夢見て母ちゃん起こしたくせに
3592840	3594840	まあ、起こしたよ
3598840	3600840	だから僕はどうするべきか
3600840	3602840	悩んでる
3604840	3606840	僕の推し認定しちゃったけど
3608840	3610840	幸せになってほしいけど
3612840	3614840	でも、幸せじゃないんだよ
3614840	3616840	その人は
3616840	3618840	でも、僕じゃあ
3618840	3620840	幸せにできないってことは分かってるし
3646840	3648840	気管に入った
3650840	3652840	気管に入っちゃった
3652840	3654840	でもさ
3654840	3656840	幸せにしたいのに自分の力じゃ
3656840	3658840	幸せにできないって辛いよね
3658840	3660840	それ辛いよね
3660840	3662840	でも僕も
3662840	3664840	恋人作って
3664840	3666840	自分が元気になったら
3666840	3668840	支えてあげられるようにしたい
3668840	3670840	記憶ありがとう
3676840	3678840	だから僕は
3678840	3680840	僕に力があったら
3680840	3682840	支えてあげられる
3682840	3684840	自分が幸せで
3684840	3686840	力があったら
3696840	3698840	でもループ
3698840	3700840	ループとか言われてるけど
3700840	3702840	スパイラルだからね
3702840	3704840	なんでもいいよ
3704840	3706840	今は力はない僕には
3706840	3708840	何の力もない
3712840	3714840	記憶ありがとう
3714840	3716840	忍法痩せた
3716840	3718840	痩せてるでしょ
3718840	3720840	20キロ痩せたんだけど
3720840	3722840	あの一番太ってたこれより
3722840	3724840	20キロ痩せた
3728840	3730840	だから
3730840	3732840	だから
3734840	3736840	がんの可能性があるって
3736840	3738840	言ってるの
3738840	3740840	だからがんの可能性が
3740840	3742840	あるって言ってるんだよ
3742840	3744840	わかる
3744840	3746840	だって普通さ
3746840	3748840	何もダイエットとかしないで
3748840	3750840	痩せないじゃん
3750840	3752840	ご飯が食べられなくなったってのあるけど
3752840	3754840	そこまで短期間で20キロ
3754840	3756840	痩せるっておかしいじゃん
3756840	3758840	やばいんだよ
3758840	3760840	わかる?
3760840	3762840	がんかもしれないんだよ
3770840	3772840	俺はただ
3772840	3774840	そのね
3774840	3776840	リスナーさんの彼女に
