start	end	text
0	3000	ちょっと髪の毛整えるね
3000	6000	おはよう
6000	9000	ワコツいらっしゃい
9000	11000	この時間ダメかな
11000	13000	でもどうしてもなんかさ
13000	18000	寂しくて配信したくなっちゃった
18000	19000	おはよう
19000	21000	ヒヨコいっぱいありがとう
21000	23000	タヌキ理解した
23000	27000	これからはタヌキでやってく
27000	31000	だってみんながタヌキつけろって言うんだもん
37000	39000	おじいちゃんも寝る時間でしょ
39000	42000	いや、今起きたとこ
43000	46000	僕さ
49000	52000	僕ね
53000	56000	僕ね
56000	59000	みんなに行っていいかな
61000	64000	僕ね
70000	74000	あ、カミネ誘引さんいらっしゃい
74000	77000	おはよう
78000	82000	あ、ヒヨコいっぱいありがとう
82000	87000	僕なんかイベントで1位になって2000ポイントもらった
87000	92000	イベントで1位になって2000ポイントもらいました
92000	95000	パンツゲーはやりません
97000	102000	これから、あ、カミネ先生来てくれたね
108000	112000	一晩寝たからリセット
112000	115000	寝たら大抵リセットされちゃうよね
115000	118000	あ、なんか来た
118000	122000	ハロウィンの何とか、何とか来た
122000	125000	ありがとう
127000	129000	ありがとう
129000	131000	ニコ生と違って猫かぶってる
131000	134000	いや、別にかぶってないよ、全然
134000	137000	全然かぶってないよ
139000	142000	ヒヨコありがとう
144000	146000	兄様おはよう
146000	149000	うつは治ってないけど
149000	152000	でもありがたいよ
154000	157000	僕さ
157000	161000	幸せになってほしい人がいるんだ
164000	168000	幸せになってほしい人がいるんだ
189000	193000	まあ、金像としておこう
194000	197000	僕さ
197000	201000	幸せになってほしい人いるんだ
201000	206000	その人がどうやったら幸せになれるかってずっと考えてた
210000	217000	その人がどうやったら幸せになれるかっていうことをずっとずっと考えてた
223000	225000	ちょっと
225000	228000	耳かきしていい?
229000	231000	僕
231000	233000	幸せになってほしい人がいる
233000	235000	なんかさ
235000	239000	好きとか恋とかそういうんじゃなくて
239000	245000	この人は絶対幸せになってほしいっていう人がいるの
247000	250000	それ配信で言う意味あります?別にいいじゃん
250000	254000	俺の配信だから何言ったって自由じゃん
257000	261000	幸せになってほしい人がいる
281000	284000	なんか自分の命よりも
284000	288000	大切な命ってあるよね
288000	290000	自分がさ
290000	294000	の命よりも大切な命ってあるよね
295000	298000	評価ありがとう
298000	302000	なんかその人がさ苦しんでるとさ
302000	304000	僕も苦しいし
304000	309000	その人が笑ってくれてると僕も笑顔になれるし
312000	315000	なんかそんな人
317000	320000	髪の毛決まんないなって
320000	323000	髪の毛決まんないなって
323000	326000	髪の毛決まんないな
326000	329000	なんかそういう人
330000	332000	分かる?
333000	336000	恋とかそういうレベルじゃなくて
336000	341000	別にその人と付き合いたいとかそういうんじゃなくて
342000	345000	あるよねそういうこと
346000	349000	陰ながら応援したいっていう
349000	352000	陰ながら応援したいっていう
355000	358000	陰ながら応援したいっていう
361000	364000	誰かを言わないけど
373000	376000	宝金像に恋してるのかな僕
377000	380000	宝金像に恋してるのかな
381000	384000	その人を宝金像と仮定する
386000	389000	その人を宝金像と仮定する
393000	395000	実際会ったことはない
395000	398000	でも幸せになってほしい
398000	401000	だから僕はさ
401000	405000	僕的のツイッターでなんか言っちゃったじゃん
406000	408000	でもあれは嘘じゃないんだよ
408000	411000	本当にそう思っちゃったんだよ
419000	422000	ひよこありがとう
423000	426000	ひよこありがとう
440000	443000	コラボ今やってるよ
445000	448000	ごめん
448000	451000	逆流生殖動園だからゲップが出ちゃった
451000	454000	ごめんね
455000	458000	めんごめんご
459000	462000	どうしたらさ人を幸せにできると思う
465000	468000	どうしたら人を幸せにできると思う
471000	474000	どうしたら人を幸せにできると思う
475000	478000	どうしたら人を幸せにできると思う
493000	496000	なんか僕自分の幸せとかもうどうでもよくなってきた
500000	503000	なんか僕はもうさ
504000	506000	僕ってさ
506000	508000	彼女欲しいとか言ってるじゃん
508000	509000	でもさ
509000	512000	高い確率でできないよね
512000	515000	彼女って
517000	519000	彼女って僕できないよね
519000	522000	もう高い確率で
529000	532000	たぬき始めたよ
532000	535000	高い確率で僕って彼女できないよね
540000	543000	できるかな
543000	546000	僕のこと好きな人いる
547000	550000	でも配信で見せてる僕なんて僕の
551000	554000	ほんの5%ぐらいだよ
554000	557000	あとの95%は配信では見せてないよ
563000	566000	そんな感じだよ
566000	569000	配信で見てる僕が全てだと思ったらお間違いだよ
585000	588000	寝てリセットしたかな
588000	591000	寝てリセットしたと思う
592000	595000	一晩寝たら
595000	598000	リセットされちゃった
604000	607000	どんなに辛くても悲しくても
607000	610000	一晩寝たらリセットされて
610000	613000	でもまたこっからどんどん落ちていく
615000	618000	恋に落ちていく
619000	622000	恋に落ちていく
623000	626000	っていう歌あるじゃん
628000	631000	私はあなたの恋人になりたいって歌
635000	638000	こっちを向いて
639000	642000	恋に落ちていく
649000	652000	歌あるよ
652000	655000	あなたの恋人になりたいって歌
655000	658000	それ好きなんだ僕
660000	663000	なんかさ
664000	667000	好きな人のためにさ
667000	670000	例えば好きな人が
670000	673000	不幸だったってするでしょ
673000	676000	そしたら僕も一緒に不幸に
676000	679000	その人の不幸に付き合って
679000	682000	不幸になってあげた方がいいと思う
684000	687000	一緒に不幸になってあげた方がいいと思う
689000	692000	それとも俺が幸せにするんだって言って
693000	696000	幸せにしてあげた方がいいと思う
700000	703000	でも僕じゃ幸せにはできないけど
704000	707000	影ひなたからサポートして
707000	710000	幸せにしてあげるの
715000	718000	おすすめから寄生されてる?
723000	726000	おすすめから寄生されてないじゃん
726000	729000	なんでそんな嘘言うの
730000	733000	全然寄生されておらんやないか
735000	738000	おすすめ載ってるよ
741000	744000	互いに惹かれあい
745000	748000	なんだっけ
748000	751000	歌忘れちゃった
755000	758000	今まで人を幸せにしたことあるの?
758000	761000	いや、ないかも
762000	765000	今まで僕は人を幸せにしたことはない
766000	769000	あ、初コメありがと
770000	773000	今まで僕は人を幸せにしたことはない
773000	776000	人を幸せにしたことはない
776000	779000	あ、初コメありがと
780000	783000	今まで人を幸せにしたことはない
783000	786000	僕は多分
787000	790000	多分ね
797000	800000	人を幸せにしたことはない
801000	804000	人にそこまで影響力を与えたことはない
812000	815000	失礼します
815000	818000	僕は
819000	822000	これからは人を幸せにしたい
822000	825000	好きな人を幸せにしたい
825000	828000	まずそれには自分の心が健康じゃなければダメなんだよ
830000	833000	人を幸せにするには
834000	837000	自分の心が健康じゃなければダメなんだよ
846000	849000	俺さ、本当にさ
849000	852000	幸せにしたいからさ
852000	855000	自分の心が健康じゃなきゃいけないけど
855000	858000	でも
858000	861000	一緒に不幸になってあげるっていうのもあるよね
864000	867000	一緒に不幸になってあげるって
867000	870000	その人に寄り添うのも愛の形じゃん
879000	882000	泣かない
883000	886000	僕は泣かない
886000	889000	泣かない
890000	893000	水流れてる音は知らん
893000	896000	勝手に流れてる
897000	900000	なんか漏れてる水道管が
900000	903000	水道管が漏れて
903000	906000	水がずっとピロピロ流れてる
906000	909000	記憶ありがとう
910000	913000	水道管はわからん
913000	916000	なんかそういう元気がない
916000	919000	なんか元気がない
936000	959000	今
960000	963000	今、リクエストできる人がいないようです
963000	970000	できる人がいないようです
972720	977400	どうぞありがと
977400	981680	よくありがとね
981680	984760	どうしたらいいんだろう俺
984760	989760	これどうしたらいいと思う
989760	995760	すいません男性女性僕に性別はありませんトランスジェンダーです
995760	1000320	トランスジェンダーです
1000320	1007320	僕ってどうしたらいいと思う
1014320	1019320	僕ってどうしたらいいと思う
1019360	1023640	元気だしてありがとクロヌコさん
1023640	1027360	クロヌコさんコラボしようぜ
1027360	1031400	クロヌコさん
1031400	1038400	クロヌコさんコラボしようぜ
1039280	1041400	今ですか
1041400	1047920	だって昨日コラボできなかったから
1047920	1051720	ちょっと恋愛相談とかしたいなと思って
1051720	1056720	まぁ恋愛相談でもないけど
1056720	1060800	クロヌコさんコラボしようぜ
1060800	1067800	ちょっと待ってください
1067800	1074800	コラボした相手を探す
1083880	1087520	クロヌコさんとは付き合えないけどね
1087520	1092600	僕は恋人を作れる状態じゃない今
1092600	1096920	今僕は恋人を作れる状態じゃない
1096920	1098920	だって
1098920	1103760	ひとひとり幸せにできないんだもん
1103760	1110760	なんかありがとう
1110760	1117760	このメガネミニオンみたいで可愛いでしょ
1133560	1135560	このメガネミニオンみたいで可愛いでしょ
1135560	1142560	俺たちミニオン
1145040	1147560	親方様が大好き
1147560	1152000	こんなキャラじゃないよね
1152000	1156120	そもそもミニオンって喋んないよね
1156120	1160560	ミニオンって喋んないよねそもそも
1160560	1164560	忍法不安の死になったの
1164560	1170440	横生が辛いから
1170440	1177000	俺さどうやってさ人を幸せにしたらいいのか分かんない
1177000	1184000	どうやって人を幸せにしたらいいんだろう
1185000	1188000	関わらないほうが一番いいのかな
1194000	1197000	関わらないほうが一番いいのかな
1197000	1200000	関わらないほうが幸せにできるのかな
1214000	1220000	最近知り合った女性がいまして
1220000	1225000	その人を幸せにしたいんだけど
1225000	1232000	その人は恋愛としては僕を見てくれないのね
1232000	1238000	でもその人も僕と同じ精神疾患を抱えているの
1238000	1241000	それで相談に乗ってくれたりしてたの
1245000	1252000	とにかく幸せにしたいと思う
1252000	1255000	恋愛とか関係なく
1255000	1260000	その人が不幸だと僕も不幸だと思う
1260000	1262000	良くありがとう
1265000	1268000	俺みんなが大好きだよ
1268000	1272000	俺さこれからの人生さ
1272000	1276000	楽しいことだらけで生きていきたい
1276000	1279000	今までさ不幸だったじゃん
1279000	1283000	その分楽しいことだらけで生きていきたい
1283000	1286000	今までさ不幸だったじゃん
1286000	1288000	今までさ不幸だったじゃん
1288000	1294000	その分楽しいことだけで満たしていきたいと思ってる
1298000	1301000	楽しいことだけで
1307000	1312000	楽しいことだけで生きていきたい
1312000	1316000	でも楽しいことがなかったらもうダメじゃん
1316000	1322000	僕は人生において目的があるの
1322000	1325000	今まで辛かった僕は
1325000	1329000	引きこもったりしたりいじめられたり
1329000	1332000	パワハラ受けたり
1336000	1341000	でもそれでも
1342000	1345000	これから幸せなことをいっぱいにすれば
1345000	1350000	プラスマイナスゼロになるんじゃないかなと思ってる
1360000	1369000	君はいつもは私を恋に落ちたい
1369000	1371000	ちょっと待って
1372000	1377000	あなたの恋人になりたい歌詞
1384000	1387000	互いに惹かれあって
1387000	1392000	僕たちは出会ってしまう
1393000	1397000	互いに惹かれあって
1397000	1401000	僕たちは出会ってしまう
1401000	1408000	僕はいつかあなたの恋人になりたい
1408000	1416000	あなたは何も知らない知らなくても大丈夫
1416000	1423000	すれ違いのはじまりはささくれみたい
1423000	1431000	恋に落ちている恋に落ちている恋に落ちている
1431000	1434000	こっちを見てよ
1435000	1437000	オンチかなメガホンありがとう
1437000	1443000	俺さ生まれて初めてかもしれない人を幸せにしたいと思ったの
1444000	1447000	この人を幸せにしたいと思ったの
1447000	1451000	今までは僕が自分が幸せになりたいと思ってたの
1451000	1456000	僕は今まで自分が幸せになりたいと思ってたのね
1456000	1460000	でも初めてかもしれない
1460000	1465000	人を幸せにしたいと思ったの
1466000	1472000	人を幸せにしたいと思ったのって初めてかもしれない
1476000	1478000	恋とかじゃないんだよな
1478000	1482000	なんだろう、崇拝
1482000	1487000	恋とか愛とかそういう低次元なレベルの話じゃなくて
1487000	1492000	崇拝してる
1493000	1495000	分かる?この気持ち
1495000	1498000	記憶ありがとう
1498000	1501000	配信でペラペラ話されてその人幸せか
1501000	1508000	だって別に生の人とかじゃないし別にリスナーさんだもん
1517000	1519000	その人に彼氏できても数倍
1519000	1523000	俺ね彼氏作ってほしいって言ってるよ
1525000	1528000	素敵な彼氏ができたらいいねって
1533000	1536000	素敵な彼氏ができたらいいねって言ってるよ
1538000	1544000	俺じゃあ不足だったから素敵な彼氏ができるといいねって
1549000	1568000	だから僕は幸せにしたいんだよ
1568000	1570000	僕は幸せにしたい
1570000	1572000	彼女を幸せにしたい
1580000	1585000	だから一緒に不幸に落ちるのは嫌だ
1585000	1588000	不幸に落ちてもいいと思ってたけど
1588000	1595000	彼女となら不幸に落ちてもいいと思ってたけどでもやっぱり嫌だと思った
1602000	1604000	記憶はありがとうね
1604000	1606000	前向きに行こう、そうだね
1610000	1613000	ふわっちに何しに来たんだ
1613000	1615000	君に関係ある
1615000	1617000	にんぽうやんありがとう
1620000	1622000	おはようありがとう
1626000	1629000	課金投げしたコメしか読まんのバカじゃないの
1629000	1631000	当たり前じゃん
1632000	1636000	課金してくれる人のコメント読むのは当たり前じゃん
1637000	1640000	だって俺のことそこまで好きなんだから
1640000	1642000	メガフォンありがとう
1644000	1647000	でもいいコメントがあったら読むよ
1649000	1651000	いいコメントがあったら読むよ
1651000	1653000	ちょっと待ってね
1660000	1662000	乾杯ありがとう
1662000	1664000	朝ごはん食べてない
1664000	1666000	なんか
1666000	1670000	昨日はハンバーガー食べたからお腹空いてない
1677000	1679000	全然お腹空かない
1679000	1683000	今日の仕事は僕仕事してないんですよ
1683000	1685000	これが仕事かな
1685000	1687000	ふわっちで
1687000	1690000	ふわっちとかニコ生とかが仕事かな
1694000	1696000	メガネはいっぱい持ってる
1696000	1698000	僕はメガネを持っている
1698000	1700000	メガネを持っている
1700000	1702000	メガネを持っている
1702000	1704000	メガネを持っている
1704000	1706000	メガネを持っている
1707000	1709000	メガネはいっぱい持ってる
1709000	1713000	僕メガネコレクターだから6本くらいメガネ持ってます
1713000	1715000	可愛いメガネ
1715000	1717000	メガネコレクターです
1721000	1723000	メガネコレクターね
1723000	1727000	1つ7,8万円のメガネを6本持ってます
1729000	1732000	新型メガネは来年買いたいけど
1735000	1738000	でもお金が最近ないから
1754000	1757000	お金が最近ないからあれなんだよ
1760000	1762000	ドは変わんない
1762000	1766000	人間って成長しきっちゃうとドが変わらないの
1768000	1773000	成長段階で眼球が伸びてドが変わるんだけど
1773000	1777000	一度ドが変わって固定されちゃったらもう
1777000	1781000	眼球の大きさとか変わらない
1782000	1784000	大きさとか変わらないから
1784000	1787000	これ以上金顔にはならない
1787000	1790000	今のメガネでずっと見える
1794000	1797000	今日のメガネもいいねありがとう
1798000	1800000	おはよう
1804000	1806000	評価ありがとう
1811000	1814000	じゃあ歌います
1841000	1844000	あなたの好きな人
1844000	1848000	僕はまだ名前も知らない
1848000	1852000	あなたのせいです
1852000	1858000	素敵な横顔のせいで
1858000	1862000	話しかけることができない
1862000	1870000	でも僕はいつかあなたの恋人になりたい
1870000	1875000	あのね今恋に落ちている
1875000	1878000	恋に落ちている
1878000	1884000	チョコより甘い温度で溶ける
1886000	1888000	どう?
1888000	1890000	おはよう
1890000	1892000	今日のメガネいいね
1894000	1898000	この歌をカラオケで歌いこなしたいなと思ってる
1901000	1905000	あなたの恋人になりたいって歌
1907000	1909000	いや俺さ
1909000	1912000	俺どうすればいいと思う
1914000	1918000	男だったら彼女が不幸になっているのを
1918000	1922000	なっていくのに付き合って自分も不幸になるか
1922000	1928000	それとも俺が幸せにしてやるっていう決意を持って幸せにするか
1928000	1930000	そこなんだよな
1931000	1935000	僕は一緒に不幸になってあげたいけど
1935000	1937000	怖い
1940000	1944000	一緒に不幸になってあげたいけど怖いちょっと
1947000	1949000	ちょっと待ってバグってるな
1949000	1952000	コメント欄がバグってる
1954000	1956000	コメント欄がバグってる
1956000	1958000	コメントが見えない
1959000	1962000	みんなコメント打ってくれてる?
1964000	1967000	みんなさあ今コメント打ってくれてる
1968000	1970000	コメントが見えないんだけど
1974000	1976000	ごめんみんなのコメントが見えん
1976000	1978000	なんかコメント欄がバグって
1982000	1984000	みんなのコメントが見えない
1987000	1989000	コメント打ってる?
1990000	1992000	コメント欄がバグってる
1992000	1994000	ちょっと更新するね
1996000	1998000	更新するね
1999000	2001000	更新するね
2011000	2014000	なんかコメント欄がバグってたんだけどさっき
2015000	2017000	ふわっちしっかりしてくれよ
2022000	2024000	ふわっちしっかりしてくれよ
2024000	2026000	コメント欄がバグってるし
2036000	2038000	みんなみんな
2038000	2040000	みんなみんな
2040000	2042000	みんなみんな
2042000	2044000	みんなみんなみんなみんな
2044000	2046000	フラッチサーバー弱いの?
2046000	2048000	このサイトサーバー弱いのか?なんだ
2050000	2052000	あー寒っ
2052000	2054000	今日寒くね?今日寒くね?なんか
2055000	2057000	ヘイホーキンゾウ
2057000	2059000	ヘイホーキンゾウ
2059000	2061000	コメント一応今は見えてる
2061000	2063000	でもさっきは見えなかった
2063000	2065000	コメントが全然流れなくて
2065000	2067000	キャーかっこいい
2067000	2069000	だいぶ閲覧減りました
2069000	2071000	みーよ別に閲覧とか
2079000	2081000	クロヌコさんが待ってる
2081000	2083000	あクロヌコさん
2083000	2085000	リクエストを送ろう
2087000	2090000	クロヌコさんにリクエストを送ろう
2096000	2098000	やっぱ女性である
2098000	2100000	クロヌコになった方がいいの
2100000	2102000	あー
2102000	2104000	話聞いてたら
2104000	2106000	ニンポウさん自身が
2106000	2108000	ニンポウさん自身が
2108000	2110000	メンタルがちょっと
2110000	2112000	メンタルがちょっと弱いじゃないですか
2116000	2118000	まず
2118000	2120000	ニンポウさんが
2120000	2122000	先に
2122000	2124000	先に幸せになったらいいんじゃないですか
2124000	2126000	先に幸せになって
2126000	2128000	でも僕は恋人ができないと幸せになれない
2128000	2130000	でも自分が
2130000	2132000	自分が幸せにならないと
2132000	2134000	人に幸せって与えられないじゃないですか
2134000	2136000	人に幸せって与えられないじゃないですか
2136000	2138000	僕は恋人くて幸せになる感じか
2138000	2140000	あクロヌコさんの顔見たよ
2140000	2142000	昨日コラボ
2142000	2144000	あ昨日コラボ
2144000	2146000	してもらえなかったんですけど
2146000	2148000	精神状態が悪かったからコラボできなかったけど
2148000	2150000	あすいません
2150000	2152000	クロヌコさんなんか写真とイメージ違うね
2152000	2154000	違いますね
2154000	2156000	全然違う人かと思った
2156000	2158000	すいません
2158000	2160000	勤めてるとかそういうわけじゃなくて
2160000	2162000	印象違うなって思った
2162000	2164000	写真と動画両方とも
2164000	2166000	素敵な感じで
2166000	2168000	ありがとうございます
2168000	2170000	だから自信持ちな
2170000	2172000	ありがとうございます
2172000	2174000	ステージ4の
2174000	2176000	映画
2176000	2178000	アパンチあるんですか
2178000	2180000	ただ周り側そう言ってるだけ
2180000	2182000	ステージ4の
2182000	2184000	可能性があるだけで
2184000	2186000	なるほど
2186000	2188000	なるほど
2188000	2190000	彼氏とかいる?
2190000	2192000	彼氏いる?
2192000	2194000	彼氏いないです
2194000	2196000	なんでですか?
2196000	2198000	ちょっと興味深いんで
2198000	2200000	昨日私のこと言ってましたよね
2200000	2202000	好きって言ってましたよね
2202000	2204000	別に好きとかじゃないよ
2204000	2206000	好きじゃないですか
2206000	2208000	がっかりしてる
2208000	2210000	ちょっと
2210000	2212000	半分本気に問われちゃったんで
2212000	2214000	でも
2214000	2216000	全然お互い知り合って間もないじゃん
2216000	2218000	だから分からないじゃん
2218000	2220000	お互いのこと
2220000	2222000	だからこれから分かり合っていかないと
2222000	2224000	分かり合っていかないと
2224000	2226000	分かり合って
2226000	2228000	何も知らないんだよ
2228000	2230000	僕はどういう人間で
2230000	2232000	配信会だとどういう感じなのかとか
2232000	2234000	僕今キャラクターだからね
2234000	2236000	でもそのまんまでしょ
2236000	2238000	素でしょ
2238000	2240000	素は全く喋らない
2240000	2242000	押し黙って
2242000	2244000	つむいて
2244000	2246000	うーって言ってるだけ
2246000	2248000	そんな感じなんだけど
2248000	2250000	そういう男どう思う
2250000	2252000	配信会見てみないと分かんない
2252000	2254000	見てみないと分かんない
2254000	2256000	動画とかしないよ僕
2256000	2258000	そうですよね
2258000	2260000	この時間ってギフト投げられるかな
2260000	2262000	分かんないです
2262000	2264000	VSしたらギフト投げられると思う
2264000	2266000	でも昨日もこの時間じゃなかった
2266000	2268000	昨日もこの時間じゃなかった
2268000	2270000	平日じゃん
2270000	2272000	見てる人が多くないんだよ
2272000	2274000	みんな仕事で
2276000	2278000	VSしますか
2278000	2280000	バトル
2280000	2282000	赤こい
2282000	2284000	私が赤じゃないの
2284000	2286000	私が赤じゃないの
2286000	2288000	こっちから見たら私が赤なんだけど
2288000	2290000	じゃあ僕が青
2290000	2292000	自分の画面が赤
2292000	2294000	俺がんばれ
2294000	2296000	忍法がんばれ忍法軍
2296000	2298000	忍法軍来た
2298000	2300000	忍法軍来た
2300000	2302000	筋肉です
2302000	2304000	じゃあこれちょっと
2304000	2306000	忍法さん勝ったら
2306000	2308000	忍法さん勝ったら
2310000	2312000	3日の日にリアルコラボしましょう
