start	end	text
3776840	3778840	笑ってほしいだけなんだよ
3780840	3782840	笑ってほしいだけなんだよ
3784840	3786840	だからその人が幸せになるように
3788840	3790840	その人が幸せになるように
3790840	3792840	その人が幸せになるように
3792840	3794840	僕は何とかしたいんだけど
3794840	3796840	僕は何とかしたいんだけど
3796840	3798840	僕の力じゃどうしようもない
3802840	3804840	忍法さんに会いたい
3812840	3814840	健康体の人が演技してるとしか見えませんが
3818840	3820840	なんでそういうことや
3820840	3822840	僕本当体調悪いんだけど
3822840	3824840	今日だってめちゃくちゃ頭痛とかして
3824840	3826840	頭振るとジンジンするし
3830840	3832840	辛いんだよこっちだって
3838840	3840840	こっちだって辛いんだよ
3840840	3842840	こっちだって辛いんだよ
3848840	3850840	でも楽しくやらないとね
3850840	3852840	楽しく
3854840	3856840	でも
3856840	3858840	ダメになっちゃうときもある
3858840	3860840	僕だって人間だから
3860840	3862840	昨日とかダメになっちゃったし
3866840	3868840	ダメになっちゃうこともあるよ
3870840	3872840	でも
3876840	3878840	いや頭痛は分かんない
3878840	3880840	正体不明
3882840	3884840	毎日頭痛がする
3884840	3886840	最近はちょっとよくなかったかな
3892840	3894840	変頭痛
3894840	3896840	だからロキソニンが効かないんだよ
3896840	3898840	ロキソニンも効かない、ボルタレンも効かない
3898840	3900840	そういう頭痛ってある
3902840	3904840	ロキソニンもボルタレンも
3904840	3906840	効かないけど
3906840	3908840	バファリンプレミアムデラックスだけは
3908840	3910840	なぜか効くっていう
3910840	3912840	ダメだよ
3926840	3928840	ニーサミット
3928840	3930840	ニーサミットやろうかな
3930840	3932840	ニーサミット
3940840	3942840	あ、ちょっと待って
3942840	3944840	母ちゃんから電話だ
3944840	3946840	なんか母ちゃんが電話かかってきたわ
3948840	3950840	なんか最近母ちゃんが
3950840	3952840	やったら俺のこと心配して
3952840	3954840	電話かけてくるの
3954840	3956840	俺のメンタルが安定しないから
3962840	3964840	僕のメンタルが安定しないから
3966840	3968840	なんか母ちゃんが
3968840	3970840	すごく心配してる
3978840	3980840	メンタルが安定しない
3980840	3982840	なんか俺もさ
3982840	3984840	人のこと助けたいとか言ってる
3984840	3986840	けど自分のメンタルが
3986840	3988840	まず安定しない
3990840	3992840	なんかもう
3998840	4000840	親を大切にしないと
4000840	4002840	親も70歳過ぎてるからね
4004840	4006840	いつぽっくり言っても分かんないから
4012840	4014840	いつぽっくり言っても分かんないからね
4014840	4016840	でもさ
4016840	4018840	好きなものは好きなんだから
4018840	4020840	仕方なくないか
4020840	4022840	好きなものは好きなんだから
4036840	4038840	好きなものは好きなんだから
4038840	4040840	仕方なくないか
4040840	4042840	粘着するなとか言うけど
4042840	4057840	なとか言うけど
4057840	4062760	男の愛だ 受け取れ
4062760	4070000	これはメゾン一国で5代有作が 音無し京子さんに襲おうとした
4071000	4075000	男の気持ちだ 受け取れ
4075000	4080000	大人しく京子さんを抱こうとする
4080000	4085000	僕愛が重いよ 僕と付き合うってことはめちゃくちゃ重たいことだよ
4085000	4090000	だって僕43歳同亭だよ めちゃくちゃ重たいよ
4090000	4097000	その43年間の思いが全てこもってるんだよ 僕の同亭に
4098000	4103000	全てこもってるんだよ だからめちゃくちゃ重いよ僕と付き合う人は
4103000	4111000	だからそんな簡単に付き合おうとか 言ってほしくないね
4111000	4121000	黒ぬこさんも僕のこと好きかもしれないけど そんな気持ちじゃ僕には向き合えないよ
4121000	4124000	そんな気持ちじゃ僕には向き合えないからね
4124000	4128000	兄様だ ありがとう
4131000	4138000	僕めちゃくちゃ重いからね愛が 僕めちゃくちゃ愛が重い自分でも分かってる
4138000	4142000	好きになったらもうその人しか見えなくなる
4142000	4147000	黒ぬこさんは僕のこといいと思ってくれてるらしいけど
4147000	4151000	でもそれじゃ付き合えないよその程度じゃ
4151000	4155000	僕のためだったら何でもできるっていう人じゃないと
4155000	4158000	こういうこと言ったら番になるかもしれないけど
4158000	4161000	僕のためだったらほんやらできるとか
4161000	4167000	僕が苦しんでたら人の苦しみを取り除くために 砲を置かしてくれるっていう人がいる
4167000	4174000	僕が苦しんでたら人の苦しみを取り除くために 砲を置かしても構わんとか言うぐらいのレベルの
4174000	4177000	愛され方じゃないと僕無理だよ
4182000	4187000	だってさ 押しのこでさアクアが
4187000	4192000	俺は芸能界で殺したいやつがいるって言ったら
4192000	4197000	アカネが私も一緒に殺すよって言うんだよ
4200000	4203000	アクアがさ
4203000	4207000	芸能界で殺したいやつがいるって言ったらさ
4207000	4210000	アカネがさ
4210000	4214000	私も一緒に殺すって言うんだよ
4214000	4217000	犯罪を犯してでも
4217000	4222000	その人のそばにいたいって思える気持ちが
4222000	4225000	泣けた
4225000	4227000	泣けたよ
4227000	4231000	犯罪を犯してでも
4231000	4234000	その人のためになりたいって
4234000	4237000	普通そんな愛ないじゃん
4237000	4240000	僕にはそういう人ができたことがなかったから
4240000	4244000	僕のために砲を置かす人がいなかったから
4244000	4247000	でも僕は
4247000	4252000	自分のために砲を置かすぐらいの気持ちを持ってくれる人がいたら
4252000	4256000	その人を一生大事にするよ
4262000	4267000	僕はその人を一生大事にするよ
4267000	4269000	だから
4269000	4274000	アカネが好き僕は一番もしのこで
4276000	4280000	一緒に殺すよって言ってくれるの
4291000	4294000	だからそれが泣ける
4300000	4303000	どうしたらいいんだろう
4303000	4307000	どうしたら感情を救えるんだろう僕は
4315000	4317000	みんな
4317000	4321000	ギフトはこう打たらいけないけど
4321000	4325000	ギフト投げてくれたら嬉しいです
4326000	4330000	コラボ断られた?
4335000	4339000	コラボ断られたって本当?
4339000	4343000	別にいいけど断られても
4346000	4350000	別にいいけど断られても
4356000	4360000	君は恋に恋してるんでしょ違うよ
4360000	4363000	僕は恋するのは
4363000	4367000	自分と違った他者だっていうことは分かってるから
4367000	4371000	僕はもうモラトリアムの青年でもなんでもないんだよ
4371000	4375000	いっぱしの大人なんで43歳の等身大の大人なんで
4375000	4379000	ハートありがとう風船ありがとうヒョッカありがとう
4380000	4384000	僕あんまり人とコラボとかしないようにしよう
4384000	4388000	43歳がアニメで何個か泣くよ
4399000	4403000	俺もさ相当だけど
4403000	4407000	世の中すごい苦しんでる人がいるから
4407000	4411000	世の中すごい苦しんでる人がいるんでKPありがとう
4412000	4416000	俺も相当だけど世の中苦しんでる人がいるんで
4416000	4420000	そういう人たちが
4423000	4427000	でも彼女には苦しんでほしくない
4427000	4431000	そんな世の中やだ
4431000	4435000	僕はやだ
4457000	4461000	それはやだ
4469000	4473000	好きな人が苦しむ世の中がやだ
4473000	4477000	ハッピーハロウィンありがとう
4477000	4481000	万歳ありがとう
4481000	4485000	こんな僕にギフト投げてくれてありがとう
4485000	4489000	あんまり投げてもらえずに苦しめとか出てけとか
4489000	4493000	死ねとか首連れとかいっぱい言われたけどさ
4493000	4497000	ふわっちりすなさんがこうやって優しくしてくれるの
4497000	4501000	めちゃくちゃ嬉しいわ
4501000	4505000	ニコ生だと辛くて安心できないもん最近
4505000	4509000	よくありがとう
4516000	4520000	だから僕はこれから不安の人として頑張っていくわ
4540000	4544000	あれ母さんからまたメールだ
4544000	4548000	メールだ
4564000	4568000	母ちゃんから何かいる
4568000	4572000	すぐさラインがかかってくるんだけど
4575000	4579000	母ちゃんからしょっちゅうラインがかかってくるんだけど
4586000	4590000	母ちゃん今俺のこと心配してるんだよ俺がさ
4590000	4594000	いろいろ言っちゃったりやっちゃったりしたことで
4594000	4598000	でもそれってさどういう心配なんだろうね
4598000	4602000	自分たちは迷惑になるのがやだと思ってるのか
4602000	4606000	本当に心の底から僕のこと大切に思ってくれてるのか
4608000	4612000	心の底から僕のこと大切に思ってくれてるならいいんだけど
4617000	4621000	じゃなかったらやだよ
4621000	4625000	じゃなかったらやだよ僕
4625000	4629000	じゃなかったらやだよ
4630000	4634000	じゃなかったらやだよ
4634000	4638000	なんか悲しくなってきた
4658000	4662000	なんか悲しくなってきた
4665000	4669000	なんか悲しくなってきたもう
4679000	4683000	なんか好きな人が苦しんでるのって辛いよね
4687000	4691000	何もしてあげられないのに
4692000	4696000	好きな人が苦しんでるのって辛いよね
4712000	4718000	僕もさ何も考えないで誰かと付き合いたい
4719000	4723000	幸せで幸せの付き合いをしたい
4726000	4732000	良かったらでいいんで僕の配信が面白いと思った方は
4732000	4736000	ギフト投げてくれたら嬉しいです感謝します
4736000	4740000	僕の配信が面白いと思った方が
4742000	4746000	ギフト投げてくれたら嬉しいです
4749000	4753000	じゃないと僕他行っちゃいます
4753000	4757000	ワインありがとう
4757000	4761000	僕の配信が面白かったらギフト投げてね
4761000	4765000	面白くなかったら投げてくれなくてもいいけど
4766000	4770000	乾杯ありがとう
4778000	4782000	なんかアザがいっぱいあるな膝に
4782000	4786000	いつできたんだろう
4794000	4798000	汚い言葉とかあんまり言わないで
4798000	4802000	ギフトは今1001ポイント
4805000	4809000	最低賃金のもならない
4812000	4818000	みんなすごいアイテムとか投げてくれたら嬉しいです
4818000	4822000	僕の配信が面白いと思った方で
4822000	4826000	なんか辛くなってきた
4826000	4830000	でもさ俺別にさ
4832000	4836000	俺すべてを諦めたらそうする
4836000	4840000	自分の人生もどうにもない
4840000	4844000	自分の人生もどうにもない
4844000	4848000	自分の人生もどうにもない
4848000	4852000	自分の人生もどうにもならない
4852000	4856000	ハロウィンキャンディありがとう
4860000	4864000	僕は
4866000	4870000	頑張る
4870000	4874000	まだ頑張る一応
4874000	4878000	頑張るけど頑張る
4880000	4884000	頑張ります
4884000	4888000	頑張ります
4914000	4918000	なんか疲れた
4928000	4932000	人生について語りたい
4934000	4938000	なんか楽しいことにしたい
4938000	4942000	楽しいことだけで人生埋めたい
4944000	4948000	楽しいことだけで人生埋めたい
4948000	4952000	何フォロワーランキング非公開って
4960000	4964000	視聴者レベルってこと
4964000	4968000	これを非公開にできるの
4974000	4978000	分かんない
4978000	4982000	分かんないことをやらせないでみんな
4982000	4986000	みんな俺分かんないんだから分かんないことをやらせないで分かんないんだから
4986000	4990000	怒るよそりゃ
4990000	4994000	だってやり方とか信頼のあるしろこれしろってさ要求ばっかりしてさ
4994000	4998000	記憶ありがとう
4998000	5002000	いや怒らないようにするよ
5002000	5006000	僕も
5024000	5028000	みんな相談なんだけど好きな人が苦しんでたら
5028000	5032000	好きな人が苦しんでたら
5032000	5036000	タナトスとエロスで言えばエロス
5036000	5040000	タナトスちょっと待ってタナトスとエロスってどっちだったっけ
5040000	5044000	タナトスエロス
5044000	5048000	違い
5052000	5056000	タナトスとエロスは古代以来
5056000	5060000	伝説のある
5060000	5064000	俺は彼女にタナトスを抱いてほしい
5064000	5068000	エロスは
5068000	5072000	違うエロスがいいんだ
5072000	5076000	エロスが聖の欲求でタナトスが影なるもの
5076000	5080000	だから僕は彼女にエロスの道を進んでほしいタナトスに捕らわれないで
5080000	5084000	エロスの道を進んでほしいタナトスに捕らわれないでほしい
5084000	5088000	エロスとタナトス
5088000	5092000	だから
5092000	5096000	ラブシャフルっていうドラマであったんだよ
5096000	5100000	死にたがっている女の子を取り戻すために
5100000	5104000	君はタナトスに今支配されている
5104000	5108000	だからエロスを求めよって言うんだよ
5108000	5112000	マツダショウタが
5112000	5116000	女好きな子に君はエロスに捕らわれるべきだ
5116000	5120000	タナトスに捕らわれちゃいけないって言うんだよ
5120000	5124000	ラブシャフルっていうのじましんじ原作のドラマがあったんだけど
5124000	5128000	あれ面白いから見たほうがいいよ
5128000	5132000	みんなオラに元気を分けてくれ
5132000	5136000	星の源に似てるよく言われる
5136000	5140000	ニコ生の星の源って言われてたから
5140000	5144000	俺がどれだけ好きだか知ってる?
5144000	5148000	俺がどれだけ好きだか分かる?
5148000	5152000	俺がどれだけ好きだか分かる?
5152000	5156000	仮にAさんとしよう
5156000	5160000	Aさんのことをどれだけ好きだか分かる?
5160000	5164000	そういえば俺が初めて恋した人もAさんだった
5164000	5168000	Aさん
5168000	5172000	俺と目が合うとニコって微笑んでくれた
5172000	5176000	Aさんそれが僕の初恋
5176000	5180000	卒業式の時まで告白できずにいて2年間
5180000	5184000	卒業式の日に僕の隣にS君っていう子がいたの
5184000	5188000	S君にAさんがタタタタって駆け寄ってきて
5188000	5192000	名札ちょうだいって告白してたの
5192000	5196000	そしたらS君がいいよって言って名札をあげて
5196000	5200000	元気でねって言って
5200000	5204000	要するに俺は一部シージュを目撃してたんだよ
5204000	5208000	隣家
5208000	5212000	好きだったのにS君のこと好きだったんだって
5212000	5216000	思って
5216000	5220000	それでそれが初恋の終わり初めての失恋
5220000	5224000	というかさ
5224000	5228000	というかさここまでやっててギフトが伸びないってさ
5228000	5232000	なんか配信する意味なくないか
5232000	5236000	ここまでやっててギフトが伸びないってアイテム飛ばないって
5236000	5240000	別にアイテム欲しいわけじゃないけど
5240000	5244000	アイテム欲しいわけじゃないけどね
5244000	5248000	ありがとう
5248000	5252000	だってさファッチってそういうとこでしょ
5252000	5256000	どうし俺命懸けるべき好きな人のために
5258000	5262000	俺好きな人のために命懸けるべき
5262000	5266000	リスワン狙えば1万もらえるぞ
5266000	5270000	なにリスワンってそんな制度あるの
5270000	5274000	今ブロンズAの5位だけど
5274000	5278000	ファッチ道場3級の1位だけど
5282000	5286000	大手配信者毎日10万から60万のアイテム稼ぐんだぞ
5286000	5290000	そんなのニコ生にいないよ
5290000	5294000	イベントでもない限り僕ね最近好きな人ができたんだ
5294000	5298000	リスナーさんで僕最近好きな人ができたんだ
5298000	5302000	なんかその人と
5302000	5306000	LINEしてるとすごい落ち着くんだ
5306000	5310000	で
5320000	5324000	で
5324000	5328000	告白して振られた
5328000	5332000	でもLINEしてるとめちゃくちゃ落ち着く
5332000	5336000	その人も精神に問題を抱えてて
5336000	5340000	やっぱ同じ精神病患ってる者として
5340000	5344000	励まし合ってたんだ
5354000	5358000	でも僕とは付き合いないって言われた
5362000	5366000	僕は結構マジだったんだけど
5382000	5386000	みんなオーラに元気を分けてくれ
5386000	5388000	今元気がない
5388000	5392000	元気がないからオーラに元気を分けてくれないかな
5392000	5396000	みんなオーラに元気を分けてくれないかな
5398000	5402000	みんなサオラに元気を分けて
5404000	5408000	オラに元気を分けて
5408000	5412000	オラ元気がないが
5418000	5422000	エナドリが無い
5437000	5441000	ほら、元気無いんだ
5441000	5445000	エナドリが無い
5445000	5449000	もう、エナジードリンクが無くなっちゃった
5461000	5465000	俺、心が弱いんだよ
5465000	5469000	俺、心が弱いんだよ
5469000	5473000	このままふわっちしてていいのかな
5476000	5482000	クロヌコさんが滅ばしてくれないから フォロー外した
5482000	5486000	クロヌコさんが滅ばしてくれないから フォロー外しました
5486000	5490000	クロヌコさんとはもうこれでは 終わりです
5490000	5496000	クロヌコさんとはもうこれで終わりです フォローバーしてくんなかったから
5502000	5506000	クロヌコさんがフォローバーしてくんないから フォローバーを外した
5520000	5526000	だってフォローバーしてくんないんだ
5526000	5530000	フォローバーしてくんないんだ
5556000	5562000	フォローバーしてくんないからフォローバーを外した
5586000	5590000	フォローバーしてくんないんだ
5616000	5620000	フォローバーしてくんないんだ
