start	end	text
4396360	4400360	とにかく早丸だから19歳だったけど
4401360	4404360	19歳の頃ちょうど無職だったから
4405360	4410360	もう恥ずかしくて自分が恥ずかしくて恥ずかしくて仕方なかった
4410360	4412360	恥ずかしいの 2億18年持ち続けたんだ
4412360	4413360	恥ずかしいの 2億18年持ち続けたんだ
4413360	4414360	恥ずかしいの 2億18年持ち続けたんだ
4414360	4415360	恥ずかしいの 2億18年持ち続けたんだ
4415360	4416360	恥ずかしんが無職笑う
4416360	4417360	今もね
4418360	4420360	今はもっと恥ずかしいよ
4420360	4421360	ちょうど早めことだと言う
4422360	4423360	今は恥ずかしいよ
4425360	4429360	正直今
4430360	4432360	同層会のお誘いとか来ても
4432360	4435360	俺は行かないよ
4436360	4438360	今恥ずかしいよ
4438360	4441360	今、恥ずかしいよ。
4441360	4449360	中学とかのさ、同僧会のさ、お誘いが来ても、これは行かない。
4458360	4461360	同僧会行ったことない。
4462360	4468360	配信は別に恥ずかしくない。
4468360	4477360	でも、俺の配信を昔の同級生とかに見られるのはちょっと嫌かなと思うけど。
4477360	4485360	なんかの表紙で、俺の名前をググって、それで配信に辿り着いて、
4485360	4496360	中学とか、小学校とか、高校とかの同級生が見てたらちょっと恥ずかしいね。
4496360	4506360	リーコ?リーコには俺嫌われてるからね。
4506360	4515360	リーコは?
4515360	4531360	あ、フグちゃん、今日、誕生日なんだ。
4532360	4541360	今の時代、いろんな人いますよ。顔文字、絵画を定職についていないから恥ずかしいからないで、自道にやればいいんです。
4541360	4546360	昔の友達のこと、ググったことあるよ。
4546360	4552360	そしたら、なんかすごいリア中大学生とかになってたり、
4552360	4563360	なんか楽しそうにしてる、ツイッターみたいなのやってたり、
4563360	4575360	なんか痛たまれない気持ちになった。
4575360	4584360	まあ、だいぶ昔だよ。もうググったりはしてないけど。
4584360	4600360	なんか大学生で、なんかテニスサークルとかに入ってリア中になってたり、
4600360	4609360	ボットンが自分のこと、インキャとか地獄、どうでもいいよ。
4609360	4622360	別に、インキャ、地獄、ちょっといいキャラで売りたいんでしょ。
4622360	4625360	リーコは知ってるよ。
4625360	4633360	放送一回だけ見たけど、なんか喋り方がすごい遂げのある感じで、
4633360	4640360	あ、これはちょっとタチの悪い女だと思った。
4640360	4649360	これはタチ、でもそのリーコだけど、リーコとビックニートが会話してる動画見たの。
4649360	4658360	そしたらリーコが一人で放送してるときはキャラが全然違くて、
4658360	4677360	まるで女のこの部分がすごい出てて、もしかしてリーコってビックニートが好きなのかなと思った。
4677360	4680360	女性の部分が出てた。
4680360	4686360	なんかちょっと恥ずかしがってるような感じがして、
4696360	4704360	だからもしかしてリーコってビックニートのこと好きなんじゃないかと思った。
4708360	4722360	まあ、リーコはビックニート好きでもいいんだけどさ。
4722360	4726360	そうじゃないかの2種類しかお前の中にはないんだろうな。リーコはやれればいいみたい。
4726360	4728360	41の発言とは思えないW。
4728360	4731360	まんまんから声が出る説。
4731360	4733360	あ、もうすぐ9時半だ。
4733360	4735360	そろそろ終わるかじゃ。
4735360	4737360	リーコと結婚したら永久修職も決定するから勝ちるんだぞ。
4737360	4739360	マイちゃん。
4739360	4749360	もうね、マイちゃんのことは諦めたわ。
4749360	4752360	別にヒットはしてないよ。
4752360	4760360	リーコはそんな好きじゃないし。
4760360	4765360	いや、永久修職先輩。
4765360	4774360	今日はちょっと幼児がある。
4774360	4782360	マイちゃんとはちょっとトラブルがあって嫌われて絶縁した。
4782360	4784360	あと3分で終わるわ。
4784360	4792360	じゃあ。
4793360	4804360	マイちゃんのツイッターを見てみよう。アカウント消します。
4804360	4812360	もうアカウント消します。
4812360	4819360	もうアカウント消すんだって。
4819360	4830360	マイちゃんにDM送ってるやつって何なの?
4830360	4845360	俺のせいなの?
4845360	4855360	マイちゃんの文明は50代でかまったよ。
4855360	4865360	マイちゃんの文明は50代でかまったよ。
4866360	4875360	マイちゃんの文明は50代でかまったよ。
4875360	4885360	マイちゃんの文明は50代でかまったよ。
4885360	4894360	マイちゃんの文明は50代でかまったよ。
4895360	4903360	そういうやつはブロックすればいいじゃん。
4903360	4910360	ブロックすればいいじゃん。
4910360	4921360	なんだアカウント消しちゃうの?
4922360	4934360	マイちゃんもネットから消えちゃうのか。
4934360	4946360	なんかもう映ったわ。
4946360	4952360	じゃあちょっと映ったからこれで終わるわ。
4952360	4956360	これで終わります。お疲れ様でした。
4956360	4959360	じゃあね、バイバイ。
4959360	4969360	また何か新点がありましたら放送しますんで、よろしくお願いします。バイ。
4976360	4986360	ご視聴ありがとうございました。
