start	end	text
1340000	1341000	ピワピワヤなW
1341000	1342000	誰がお前と
1342000	1343000	遊びたいと思うのが
1343000	1344000	教えてくれ
1352000	1353000	まぁマホとやったら不利になるけどね
1353000	1354000	しみ顔持ち笑い
1354000	1355000	何があった
1355000	1356000	夜中なのに払えて
1356000	1357000	顔持ち笑い
1357000	1358000	顔持ち笑い
1358000	1359000	ワールドワイドウェブ
1359000	1360000	妊婦目がね曇りの実
1360000	1361000	なんじゃそれは
1361000	1362000	天才芸W
1362000	1363000	大駅プドマネーな
1363000	1364000	顔持ち笑い
1364000	1365000	込めじる仕事は
1365000	1366000	ムラマコと遊ぶ約束しております
1366000	1367000	申し訳ないけど
1367000	1368000	笑うわW
1368000	1369000	すごい曇ってる
1369000	1370000	妊婦も恋なんてしないなんて
1370000	1371000	励ましてやるからツイコールしろ
1371000	1372000	まだ嫌われたかどうか分からないでしょ
1372000	1373000	一度やないとな
1373000	1374000	てことでね
1375000	1376000	はげましてやるからツイコールしろ
1376000	1377000	ファーストコンタクトは
1377000	1378000	印象無いしなかったのに
1378000	1379000	いろんな女にちょっかい出した結果ですよ
1379000	1380000	顔持ちしあわせ
1380000	1381000	好きになるハードル低すぎだろ
1381000	1382000	わ
1382000	1383000	大本
1383000	1384000	今来たけどさしワールドワイドウェブ
1384000	1385000	ちゃうざーかよ
1385000	1386000	あったこともないさ
1386000	1387000	はげましてやるからツイコールしろ
1387000	1388000	W
1388000	1389000	悲しみの認可
1389000	1390000	しんばらい顔持ち笑い
1390000	1391000	あったこともない人さ
1391000	1392000	こう
1392000	1393000	こんな好きになってさ
1394000	1395000	そうだねじゃあ好きにならなくていいよ
1395000	1396000	もう
1397000	1399000	もうダメだって分かってさ
1399000	1401000	マイケルとデートする予約あるのに
1401000	1402000	見ておかしいだろ
1402000	1403000	しみがじわるね
1403000	1404000	おー
1404000	1405000	スライバー
1423000	1424000	スライバーも
1431000	1432000	相手の幸せとかまったく考えてない
1432000	1433000	しみが
1433000	1434000	鼻水でマスクすげえ異なってんな
1434000	1435000	W
1435000	1436000	時代はLGBT
1436000	1437000	マホ許せないよ
1437000	1438000	もう恋なんてしないなんて言わないよ
1438000	1439000	絶対
1439000	1440000	腕上げやがってW
1440000	1441000	ぶらまこ最低だな
1441000	1442000	お前にはひまわりが一番あってる
1442000	1443000	閉めてるのくさ
1443000	1444000	リンコがいるだろ
1444000	1445000	こっちさあすらせ
1445000	1446000	胸がくっついて
1446000	1447000	利用されてるのもいいよな
1447000	1448000	ケツが
1448000	1449000	しみが広がっていくW
1449000	1450000	ハイパーにガチこいしてしまった
1450000	1451000	兄さん
1451000	1452000	ぶらまこいったの公開してる
1452000	1453000	他の男性種でこういう配信できる
1454000	1455000	ガチこいしてる
1455000	1456000	ぶらまこのせいだぞ
1456000	1457000	リンコ
1457000	1458000	ぶっちゃ
1458000	1459000	リンク
1459000	1460000	この時間に笑わせてくれ
1460000	1461000	触られたからって好きになった女を
1461000	1462000	悪者にするな
1462000	1463000	この鼻水の量は
1463000	1464000	本気で惚れてるな
1464000	1465000	恋とかどうでもいいわ
1465000	1466000	働け
1466000	1467000	ワンチャンあると思ってるのが
1467000	1468000	最高に気もいい
1468000	1469000	男と付き合おう
1469000	1470000	もうずっとかにこもってる
1470000	1471000	励ましてやるから追効しろ
1471000	1472000	キメー
1472000	1473000	よだれてるぞ
1473000	1474000	ハイパー今から
1474000	1475000	塩ボーナツ届けてあげろよW
1475000	1476000	ハイパー大忙しやなW
1476000	1477000	汚い
1477000	1478000	ロール発射ですとかね
1479000	1480000	ハゲマしてやるから追効しろ
1480000	1481000	自分本意でくさ
1481000	1482000	電気で染みつくれるようになったか
1482000	1483000	腕を挙げたな
1483000	1484000	お前がしたのは恋じゃなくて
1484000	1485000	妄想だよ
1485000	1486000	染みが出たくなってきたW
1486000	1487000	ハゲマしてやるから追効しろ
1487000	1488000	人工やっぱり天才だな
1488000	1489000	頼めばくれるんじゃね
1489000	1490000	W
1490000	1491000	ハゲマしてやるから追効しろ
1491000	1492000	まあ
1492000	1493000	マホちゃんがさあ
1493000	1495000	ハイパーマホちゃんに恋してるんですね
1495000	1496000	めちゃめちゃ好き
1496000	1497000	好きすぎてもいい
1497000	1498000	リンちゃんウレイトの
1498000	1499000	放送荒らすは顔を持ち笑い
1499000	1500000	つ、つらいよ
1500000	1501000	包丁入りチョコでもいいの
1501000	1502000	まずメガネフォーゼ
1502000	1503000	全然いい全然いい
1503000	1504000	戦えてる戦えてる
1504000	1505000	ハイパーは包丁持っていたら
1505000	1506000	読むとけ
1506000	1507000	マホからもチョコもらえなかったの
1507000	1508000	ひとつまなのに
1508000	1509000	マホちゃんもこう
1509000	1510000	持ち悪いやつを好きになる
1510000	1511000	女だぞ
1511000	1512000	伊藤に対してさあ
1512000	1514000	こういう気持ちだったんだろうな
1519000	1521000	伊藤に対してさあ
1522000	1524000	こういう気持ちだったんだろうな
1525000	1526000	カギンするしかない
1530000	1531000	カギンするしかない
1551000	1552000	いやもう
1552000	1553000	上がりなりかとか
1553000	1554000	どうでもいいよ
1561000	1562000	だってさあ
1564000	1566000	一ツイッターとかでさあ
1566000	1567000	優しくしてくれたし
1567000	1568000	俺みたいなさあ
1568000	1569000	気持ち悪いさあ
1569000	1571000	引っ込むりにさあ
1579000	1581000	カギンしたってさあ
1581000	1583000	好きになってもらえないじゃん
1593000	1596000	カギンしたって好きになってもらえないじゃん
1608000	1610000	別にさあ
1610000	1611000	もう裸箱
1612000	1615000	裸箱なんかさあ別に好きじゃないわ
1630000	1633000	裸箱とか別に好きじゃないよ
1640000	1642000	モテモテの証券と比較するとさらに面白い
1642000	1644000	盛り上がってるよいいぞダブル
1644000	1646000	カギンして結婚した人もいる?
1660000	1662000	制定してよがさあ
1662000	1664000	子供がいいよがさあ
1664000	1666000	他に好きな人がいいよがさあ
1666000	1669000	好きなものが好きなんだからさあ
1669000	1671000	これが辛いよ
1700000	1702000	ガチコイの訳ねえだろ顔持ち笑い
1702000	1704000	人工には恋愛は無理だって
1704000	1706000	この罪の果たちのサイズ
1706000	1708000	マホちゃんと友達になればよかったのに
1708000	1710000	とよく頑張れよ
1710000	1712000	ガチコイだねそれは辛いわ
1712000	1714000	赤いものにして人弱になれ
1714000	1716000	せめて友達になりたかった
1716000	1718000	ここだけの話はイパー発生経済みやぞ
1718000	1720000	見た目がロリなら本当に言ってもいいんだろ
1720000	1722000	お前の愛が本物ならマホちゃんにさされてこい
1722000	1724000	ネタにできるならガチで恋するぜダブル
1724000	1726000	キッタネーなお前顔持ち笑い
1727000	1729000	せめてさあ
1732000	1734000	友達になりたかった
1740000	1742000	障害者だけどさあ
1750000	1752000	障害者だけど
1752000	1754000	本当に好きだったもん
1757000	1759000	ガチコイだら確認するしかないね
1759000	1761000	ストーカーなのかな
1761000	1763000	マホの勘違いで抜いてそう
1763000	1765000	ちゃんと気持ち違えないと一生このままだよ
1765000	1767000	我慢しなさいですよね
1767000	1769000	こっちも笑いすぎて辛いよ顔持ち笑い
1769000	1771000	お前マホ一本に絞る覚悟あるのか
1771000	1773000	マホちゃんと一緒だね
1773000	1775000	マホは強化性自殺して
1775000	1777000	マホちゃんとさあ
1780000	1782000	一緒に遊んだにさあ
1782000	1784000	チョコレートもらったりしたかった
1786000	1788000	お前のは中学生の初恋みたいなのやろ
1788000	1789000	意図はやりたいだけ
1789000	1791000	校長をその死にの生態を
1807000	1810000	マホちゃんがiPhone壊れたならさあ
1810000	1812000	iPhone買ってあげるよ
1817000	1819000	iPhoneが欲しいならさあ
1819000	1821000	買ってあげるよ
1846000	1848000	どうでもいい女
1849000	1850000	顔持ち笑い
1850000	1851000	そういうとこもやね
1851000	1852000	どうでもいいとか失礼だぞ
1852000	1853000	ムラマコちゃんにシフトしろや
1853000	1854000	顔持ち笑い
1854000	1856000	結局お前ってPCの前にいるだけじゃん
1856000	1857000	マイケルからも見捨てられるぞ
1857000	1858000	マガリは業者やぞ
1858000	1859000	バハムード5発くらい打っとけ
1859000	1861000	そういうところは女に嫌われるの
1861000	1862000	カキンワールドワイドウエブ
1862000	1863000	接客やワールドワイドウエブ
1863000	1864000	お前本届け知らながらいいの
1864000	1866000	でも今頃糸届こってる悔しいか
1866000	1868000	こいつチョキン120万あるから
1868000	1869000	カキンはきっかけたぞ
1869000	1870000	DTの勘違いは良くあること
1870000	1871000	いや寝ろよ
1871000	1872000	一生悩んだままでいいの
1872000	1873000	ムラマコはどうなった?
1873000	1874000	ワールドワイドウエブ
1874000	1877000	何回今ムラマコのこととか
1877000	1879000	考えられないわ
1879000	1880000	特別扱いしてくれるよ
1880000	1881000	飛んでいこうかね
1881000	1882000	ドルブからお金をかね
1882000	1883000	愛は損極じゃねえんだよ
1883000	1884000	デートはして
1884000	1885000	15万もするの
1888000	1891000	15万もするのはiPhoneって
1891000	1892000	マガリマリか
1892000	1893000	ですよね
1893000	1894000	ワールドワイドウエブ
1894000	1896000	ムラマコいっとくわ
1896000	1897000	ハイパーマコはムラマコって
1897000	1898000	期待関係だからな
1898000	1899000	女性種はこいつに優しくするな
1899000	1900000	こうなる
1900000	1901000	マホなんてバババだぞ
1902000	1903000	ムラマコだよ
1903000	1905000	何かのデートとかさ
1906000	1908000	ムラマコとデートとかする
1908000	1909000	気分じゃないわ
1909000	1910000	上からワールドワイドウエブ
1910000	1912000	キレイ4名そか
1912000	1913000	最低だな
1913000	1914000	しないカキン寄りするカキン
1914000	1915000	少し優しくされただけ
1915000	1916000	好きになっちゃった
1916000	1918000	お前それ本気で言ってるのか
1918000	1919000	アホやこいつはワールドワイドウエブ
1919000	1921000	ニッコブッチャリック
1921000	1922000	ヤバイぞTESは消せ
1922000	1923000	マガリマリかなんて
1923000	1924000	両者じゃん
1924000	1925000	まあ見た目だけなら
1925000	1926000	マホムラマコだよなW
1926000	1927000	それそうだよね
1927000	1928000	初戦5番目の女性ですからね
1928000	1929000	キレイだ
1929000	1930000	マホただいまリトートとか小胃中
1930000	1931000	ムラマコだし
1931000	1932000	カキンして結婚した人もいるよ
1932000	1933000	ムラマコなんかの
1933000	1935720	ヨヨヨitu
1940000	1941000	そういうことだぞW
1941000	1942000	嫌われる理由こういうことな
1942000	1943000	ワールドワイドウエブ
1943000	1944000	MMは本気じゃなかったのか
1945000	1946000	全てに敵を作る
1946000	1947000	マホに気持ちにたいよよ
1947000	1948000	ムラマコって物細 moments
1948000	1949000	もう Bisq uったら
1949000	1950000	生き苦しいだろ
1950000	1951000	ああもうコラゴョじゃんだわ
1951000	1952000	ムラマコと仲良くしたら
1952000	1953000	マホとは終わり
1953000	1955000	ヨヨヨヨヨヨヨヨン
1955000	1956000	ムラマコが振られた
1956000	1961340	3回目
1961340	1964840	バンヰータック
1967640	1978080	自殺
1981800	1985680	4人
1985680	1988340	ブラマコ効きの中女の扱いを勉強して出直して来いよ
1988340	1991680	笑うなダブリュー勝手に振られなかったらいいやなぁ
1991680	1994080	寝てないよリーコはお怖い怖い
1994080	1995420	こえー
1995420	1998580	ダブリュー顔持ち笑い急に持てすぎちゃったから混乱しちゃったんだね
1998580	2000280	27分もろむらまことか別に好きじゃないよ
2000280	2001280	2立てをコメントです
2001280	2003080	ワールドワイドウェブ笑ってるね
2003080	2004280	この席でクリショウハウワだね
2004280	2006580	ブラマコ戦力ない時間が解決してくれる
2006580	2009280	ブラマコはBSでKZプだけど配信者としてはお前よりはるかに
2009680	2011680	かわいそうブラマコ戦いな目線通りもいいとか失礼だなW
2011680	2013280	41歳開発で
2013280	2014880	27分もろむらまことか別に好きじゃないよ
2014880	2016080	2立てをコメントです
2016080	2018680	ああだようまいものはうまいみたいに言うなW
2018680	2020480	あけらんかい自分本位ですね
2020480	2021480	そういうこともあるだろう
2021480	2022680	よくその手の手に入ってるのに
2022680	2026980	マオ子ちゃんがさあどんな子でもさあ別にいいよ
2026980	2028080	前けれどええやんか
2028080	2030180	こういうリスナーが一番怖いんだよなスポーカーになるかいく
2030180	2031380	人生2回目の恋
2031380	2032680	お前真夜中に何してるんだよ笑
2032680	2035480	辛いねなケッツがリーコカムラマコかで悩んでるんだね
2035480	2044480	普通にさ、マガリマリカとか全然好きじゃなかったよ。
2050480	2054480	マガリマリカもさ、全然好きじゃなかったよ。
2055480	2062480	チョコレート欲しいよ、ダブル。笑わせんな。顔持ち笑い。中市ですか?治療屋方が大爆笑してるぞ。顔持ち笑い。お前はブラマコに何か行くからだろう、ダブル。
2062480	2063480	今までのチェーンで貰ったことがない。
2063480	2069480	待ってさ、マガリマリカちゃんにプロックされてもさ、本当迷惑配信者だな、なかなかだもん。
2069480	2076480	顔持ち笑い。欲しいよ、キモイ。ハイパーイーツマチ。何でその気持ちを魔法に直接言わなかったんだよ。バレンタイン終わりました。なんだこれ、ダブル。
2077480	2078480	スカイクでいいですか?
2078480	2082480	このままのこと見れよれば勝負いるよ。勝手に舞い上がって勝手に出会しているとり、ゲームワールドワイドウェブ始まってもないのに顔持ち笑い。
2082480	2088480	チョコレート欲しいよ。マスクは開けらんかい。でもマイケルいるじゃん。15日です。障害者のバチコイコは、マイケルよく見てみろよ。
2088480	2093480	魔法の姉みたいなもんだぞ、ダブル。ブラマコは女リスナーにかなり人気がある。新生ストーカーを初めて見たまに行こなってすげぇ。
2093480	2098480	だからブラマコはやめておけって止めたのに、ダブル。投げれよし瞬気。今からでも何とかなるよ。米印4レーダイです。
2099480	2112480	バレンタイン終わりましたよ。見せて買ったほうがうまいぞ。この通りにやりましたよ。なにかかったって自体でも行くんか。友達くらいならなれるんじゃね、ダブル。マイケルは10年後の魔法。マジヤベイはダブル。結局貰ったのタコスだけか、ダブル。これを配信しているのが前の過ごさ。どうでもいいけど、散結になるなよ。
2112480	2113480	これ見てるの辛いわ。言うとこぞ。この会社がブレードだよ。米印4レーダイです。何が原因なの?調子に乗って誰でも追いかけるから。今、障害者関係ねぇよ。泣きゲームできるようになってきたな。友達なればいいじゃん。残念バレンタインは終了しました。なお子は泣き笑いの猫。マオトが怯えるんだろ。いつから障害者は怯いう。おまえにはシェリーをやかたない。シェリーをやかたなおに合い。なお子のことは、うん。ストーカーよりも、みっとも姉子同時だな、ダブル。ストーカーしに、うん。マホチャー。マホなんて異等の女で反射
2142480	2150280	ヤバすぎワールドワイドウェブ。チョコもらえなかっただけで泣くないよ泣き笑い。泣き笑いの猫。恋はずらい。ストーカーほう引っかかるぞ。村間子が癒しやしてくれるよ。
2150280	2154720	41歳ひやせ。キャスタイイエーはマホちゃんに聞こえるかもしれない。ハイパーマホとなお子だったらどっちとるの?
2155720	2158720	マホちゃん。マホちゃんとさ。
2163720	2165720	遊びたかった。
2165720	2181720	今やっと大人の会談登ってるんだね。シルト氏みなんとかしろ。養児から準備なのに今日面白すぎるわ。もらってばっかりで草。不正なそんなに好きなら一番の勘でいろよ。マホなんて異等の女で反射でお前のことを持ち上してたけやぞダブル夢を覚ませ。あきらめないで。お前、医者にこういうの相談したことある。頑張って草。しずかわせやせ。ネタにすんな。
2181720	2189720	もうさ、人を好きになるのって。煮を作る演技力だけは評価してやるよ。つこんなさ。お前を本当に支えとれたらお前を打つになるんだね。
2195720	2197720	顔持ち笑い。なお壊してるの?
2197720	2199720	ケチの妊婦が。ワールドワイドウェブ。
2199720	2201720	妊婦参加け?
2201720	2213720	お、家を買ってあげよう。マホちゃんは男性の外見をそんなに気にしない人だよ。頑張って。銃に買ってあげよう。マジで収集することが出るんだなダブル。買ってから4年卒期。太っぽらだね。タコスと張り合ってるダブル。その顔で無理やろ普通に気持ち悪い。
2214720	2218720	くさ。くさ。どけち人法が。金の力か。ウソーツ。およい。なんなんだ。
2218720	2219720	およみ交信?
2219720	2222720	それはやめとけ。俺にも買ってくれ。マホに気持ちを伝えようよ。村真子に。
2224720	2234720	DTだからだよ。マジでなんなんだ顔持ち笑い。茶だより人法の方がはるかに話し面白いや。きったね、AW。マホと先回はパコっ体動が苦いか。悲しいね。こんなくだらない放送がちくらい一位W。
2234720	2236720	お前には無理だ
2236720	2238720	41個のS&W
2238720	2239720	リーコに殴さめてもらおう
2239720	2240720	子供すぎる
2240720	2241720	どうすればいいかわかるよね
2241720	2243720	以前から村馬子は好みではないと言っていた
2243720	2244720	なおこないてるぞ
2244720	2245720	なこことのことか
2245720	2246720	花見すぎたりから出すぎ
2246720	2247720	馬鹿なこと言ってねえで働け
2247720	2248720	おい
2248720	2249720	我慢しろふけ
2249720	2250720	なおこを切り捨てたんだよお前は
2250720	2251720	これが二孔二八孔いぜいの実態である
2251720	2253720	その主の怖いから取ってくれん
2253720	2254720	お前はまずそのすぎる
2254720	2255720	お前はそのすぎる
2255720	2256720	お前はまずそのすぎる
2256720	2257720	しないわ
2257720	2258720	魔法と戦界はパコって相当がにくいか
2258720	2259720	W
2259720	2260720	精神中の今がチャンスだぞ
2260720	2261720	もうリーコしかねえ
2261720	2262720	希望村馬子さん勝手に
2262720	2263720	自信邪魔者を扱いされるW
2263720	2265720	41歳が振られるだけで面白い放送
2265720	2266720	しみが顔になってる
2266720	2268720	づくって言わないと一生後悔する
2268720	2269720	上溶解しるまみで
2269720	2270720	なおこ捨てたんだよ
2270720	2271720	魔法ちゃんは愛が暴走するよ
2271720	2272720	30完全配送
2272720	2273720	なんで泣くんだよ
2273720	2274720	二孔二八孔に行こう
2274720	2275720	つらす女子よなみだなお
2275720	2276720	今までが曇ってるよ
2276720	2278720	伊藤太子からハイパー魔法取り戻せ
2278720	2279720	お前はこれから
2279720	2280720	二孔性の女の気持かっこいい
2280720	2281720	日本代表なのってけ
2281720	2282720	村馬子私には400円のクレーフ大使
2282720	2283720	出せないのには
2283720	2284720	伊藤さんには15万出すんですか
2284720	2285720	マスクなキッツラマスクなキッツラ
2285720	2286720	マスクなキッツラマスクなキッツラ
2286720	2287720	マスクなキッツラマスクなキッツラ
2287720	2288720	顔見せろよ
2288720	2289720	ビッチョビッチョワールドワイドウェブ
2289720	2290720	全部お前のせいだろ
2290720	2291720	人工さんは純粋だからすぐ
2291720	2292720	傷ついちゃうんだよ
2292720	2293720	とりあえず踊れ
2293720	2294720	上溶解しるまみで
2294720	2295720	七時に9時に
2296720	2297720	相談しろ
2297720	2298720	なんで泣いてるの
2298720	2299720	魔法なんて伊藤の女で反射で
2300720	2301720	これもさぁ
2305720	2306720	魔法ちゃんのさぁ
2306720	2309720	車の女子的に乗っけてもらってさぁ
2311720	2312720	どっかさぁ
2312720	2315720	遊びに連れてってもらいたかったわ
2330720	2331720	アレ
2340720	2342720	初声だったかもね
2348720	2350720	初声かもしれない
2352720	2355720	だって中学の時のさぁ
2355720	2357720	Aちゃんにさぁ
2357720	2360720	だときも泣かなかったしさぁ
2369720	2373720	Aちゃんに振られたときも泣かなかったし
2374720	2376720	高校の頃の
2376720	2379720	同じ学校の後輩の女の子の
2379720	2381720	彼氏が発覚したときも
2381720	2382720	泣かなかったし
2383720	2386720	マガリマリカちゃんに
2386720	2389720	ブロックされたときも泣かなかったし
2394720	2396720	41歳でさぁ
2396720	2399720	なんで初声なんてしなきゃいけないんだ
2413720	2415720	え、わ
2415720	2417720	あ
2441720	2444720	だって俺カルマ持ってないし
2444720	2446720	運転できないし
2455720	2457720	なんてさーい
2466720	2468720	もう41歳になってさ
2468720	2471720	こんな初恋なんてしなきゃいけないんだろう
2475720	2477720	なんで41歳になってまでこんなさ
2477720	2479720	人のことを好きになんなきゃいけないんだろう
2480720	2482720	なんで41歳になってまでこんなさ
2482720	2485720	人のことを好きになんなきゃいけないんだろう
2500720	2502720	ほんめーちょこはありがとう
2510720	2512720	ほんめーちょこはありがとう
2515720	2517720	マホちゃんとさ
2517720	2519720	仲良くなりたかったわ
2531720	2533720	なんでさー
2533720	2535720	もうこの年でさー
2535720	2537720	こんな辛い思いしなきゃいけないんだろう
2539720	2541720	ほんめーちょこはありがとう
2564720	2566720	もうちょー
2570720	2572720	もうここ
2572720	2574720	1ヶ月とかさ
2576720	2578720	1ヶ月とか2ヶ月ぐらいずっと
2578720	2580720	ハイパンマホちゃんのことがさ
2584720	2586720	好きでずっと食欲もなくてさ
2599720	2601720	でもマホはたこすとドライブした子の事実は受け入れろ
2601720	2603720	じゃあ恋をするな面倒くせ
2621720	2624720	どうによって食事制限なんてしてないよ
2625720	2627720	ハイパンマホちゃんのこと考えた
2628720	2630720	さーもう10キロもやせたしさ
2637720	2639720	ひとすまんなろうがなんだろうが
2639720	2641720	好きなんだからね仕方ないじゃん
2654720	2656720	もう辛いよ
2664720	2666720	あったこともないのにさー
2676720	2678720	なんだあったこともないのに
2684720	2686720	こんな時間に起きていて大丈夫ですか
2693720	2695720	辛いわ
2697720	2699720	痛いわ
2714720	2716720	マホちゃんがなんか放送で
2717720	2719720	なんか言ってた
2723720	2725720	でも日本は
2729720	2731720	1番だろうが2番と3番がいるなら
2731720	2733720	かかちはないって言われた
2745720	2747720	そういうのありがとう
2752720	2754720	でも今ギフトもらってもさ
2755720	2757720	素直に喜べないわ
2762720	2764720	あのお肉じゃありがと
2774720	2776720	あんまり笑わせないで
2778720	2780720	ハイパンマホちゃんからさー
2780720	2782720	ちょくもらいたかったわ
