start	end	text
4365940	4366940	ギフト多いあやったな
4366940	4367940	自分の都合だけ
4367940	4368940	伊藤には食力ないけど人法にやる
4368940	4370940	映画も5000本見てる人法が絶対勝ちだよ
4370940	4372940	地面は自覚が特定された豚まんじゅって
4373940	4375940	やっぱ諦めたほうがいいな
4396940	4398940	お前が可愛い女性をもに相手してもらえるわけねぇだろ
4398940	4399940	空かわれてるの気づけなw
4399940	4400940	つまりやりたいだけ
4401940	4402940	初みですこの人って犬乗車ですか
4402940	4404940	初みですこの人って犬乗車ですか
4404940	4405940	初みですこの人って犬乗車ですか
4405940	4407940	魔法ちゃんにスカイプかけたら迷惑かな
4414940	4415940	迷惑かな
4419940	4422940	こんな時間にさぁ書いたら迷惑かな
4430940	4431940	迷惑かな
4443940	4444940	迷惑かな
4460940	4461940	迷惑かな
4487940	4489940	迷惑なのかな
4491940	4492940	迷惑かな
4495940	4496940	迷惑かな
4521940	4522940	それさっき聞いた
4525940	4526940	地面って誰
4532940	4533940	地面って誰
4543940	4544940	知らないんだけど
4551940	4552940	マリアン待ってるぞ
4552940	4553940	努力もしないで好き好き言ってるのって気持ち悪いよ
4553940	4554940	うん
4554940	4556940	地面はハイパー魔法と知り合いだからそいつに接触しようぜ
4556940	4557940	魔法と出会うために全力を注げ
4557940	4559940	迷惑かどうかは抑制してから考えろ
4559940	4561940	ユバニャン見たらユバニャン好きになるんだろ
4561940	4563940	黙れ、行動するかしないか迷う時間はないぞ
4563940	4565940	地団と踏んでる時点で君の愛はそんなもんなんないね
4565940	4566940	地面ならなぁ
4566940	4567940	地面マジ
4567940	4568940	地面と話してみる
4568940	4570940	やらずに公開するより、やって公開しろ
4570940	4571940	魔法ちゃんが嬉しいって言ってくれることだよ
4572940	4573940	マゴちゃんは散々軽薄な男に被らかされて
4573940	4574940	うんざりしてるんだよ
4574940	4575940	お前の本気の愛で彼女を救ってやれ
4575940	4576940	趣味が輝いていくさ
4576940	4577940	リークを狙え
4577940	4578940	地面ならなぁ
4578940	4580940	動き出さなきゃ、何も始まらんぞ
4580940	4582940	魔法ちゃんは糸と赤いハートアーカイハートアーカイハートアー
4582940	4584940	地面今配信してるけど妊婦と話したいらしいよ
4584940	4585940	地面ならなぁ
4585940	4586940	本業5時まゆき
4586940	4587940	見る気いいけ
4587940	4588940	地面って誰?
4588940	4589940	地面知らないの
4589940	4590940	お前らとんでもないモンスターの封印を吐いちまったよ
4590940	4591940	地面ならなぁ
4591940	4592940	悪しろ次の展開
4592940	4593940	ループは飽きる
4593940	4594940	地面いけ
4594940	4596940	この顔で無色なウェブライド高いってマジで知名的だな
4596940	4597940	まだやってたのかよ
4597940	4598940	でもよ
4598940	4599940	地面知らないのかよ
4599940	4600940	お前はM面だよ
4600940	4601940	地面誰なの
4601940	4602940	面白ければ何でもいいんだよなぁW
4602940	4603940	お化けなめくじの犠牲か
4603940	4604940	地面ならなぁ
4604940	4605940	地面ならなぁ
4605940	4606940	スカイプイケア
4606940	4607940	地面はオープンネックで配信してる
4607940	4608940	受け身の男は持てない
4608940	4609940	糸は動き過ぎ
4609940	4611940	地面知らないの恥ずかしいよ今時
4611940	4612940	豚まんじゅうならなぁ
4612940	4613940	慶応の地面知らずかW
4613940	4614940	オッケー
4614940	4616940	地面が気持ち分かるいつでも欠けて欲しいってさ
4616940	4617940	自分を信じて
4617940	4618940	地面は経営技術大学大学だけどお前は
4618940	4620940	1万回言うより中央
4620940	4621940	今も未来生きてたのかよ
4621940	4622940	早速読んでよ社会のお荷物が
4622940	4624940	経営卒業してて社会の地面知らないのか
4624940	4625940	もう時間ないぞ
4625940	4626940	5枚言う気分からんかW
4626940	4627940	やる気だ
4627940	4628940	あの時間ないわ
4628940	4630940	ハイパーもほんちゃんと話したい
4630940	4631940	無理だぞW
4631940	4632940	イメチャイシーオジェ
4632940	4633940	地面はオープンネックで配信してる
4633940	4634940	名前は地面
4634940	4635940	車や免許ないの
4635940	4636940	なくてもチャリクライそうげるだろ
4636940	4637940	お前の足は何のためにあるんだ
4637940	4638940	スポーカーの目
4638940	4639940	地面任務者って
4639940	4640940	ハイパー魔法に片思うよ
4640940	4641940	男になれ
4641940	4642940	目が怖い
4642940	4643940	地面は経営技術大学
4643940	4644940	経済学部経済学科大学だけどお前は
4644940	4645940	地面は今任務を未来してる
4645940	4646940	地面は生まれ
4646940	4647940	豚まじゅうならな
4647940	4648940	地面任務を持つ
4648940	4649940	ハイパーもほんちゃんと話したい
4649940	4650940	自分の人生公開するくらいなら
4650940	4651940	行動しろよ
4651940	4652940	糸はすぐ動くから持ってる
4652940	4653940	わかった
4653940	4654940	黄色いもちはプレッカーじゃなくて
4654940	4655940	持ってるよ
4655940	4656940	つながらない
4656940	4657940	話したいなら話せ
4657940	4658940	以上
4658940	4659940	全然いい
4659940	4660940	全然いい
4660940	4661940	マホちゃん好きなんだ
4661940	4662940	きた
4662940	4663940	顔持ちばらい
4663940	4664940	地面同性12万人
4664940	4665940	こんな有名な顔持ちばらい
4665940	4666940	ティコンの体のという
4666940	4667940	チャンス
4667940	4668940	ちゃんと話したい
4668940	4669940	たー
4669940	4670940	ち
4670940	4671940	かけたW
4671940	4672940	行動力レイのストーカー技術
4672940	4673940	キャン
4673940	4674680	地面に使う
4674940	4675940	コンナではありませんだって
4675940	4676940	30日もいい
4676940	4677940	きた
4679940	4682940	よう
4682940	4683940	もう止まらないこの思い
4683940	4684940	お見れ
4684940	4686940	あ
4686940	4687940	から
4687940	4690940	オンラインじゃありませんだって
4700940	4702940	えー、交換したいわ
4718940	4720940	これまじで最後誓いな
4733940	4735940	なんかさぁ
4740940	4742940	3時間ぐらいしか寝てないな
4747940	4749940	こんな時間からこのストーカーなにしてんの
4749940	4750940	伊藤の家だろW
4750940	4751940	とけみろ
4751940	4755940	よよよよよよよよよよよよよよよよよよよよよよよよよ
4782940	4784940	もう
4789940	4791940	もうやだ
4798940	4800940	もうやだ
4812940	4813940	お前の足は何のためにあるんだ
4813940	4815940	女は1回目の電話はスルーするもんだぞさぁ
4815940	4817940	おい、今日大雨だからハローアギョークの大変だぞ
4817940	4819940	ちゃんと会いに行って終わらせないと久しいのフィルムで泣けないぞ妊婦
4819940	4820940	今日朝大雨やぞ
4820940	4821940	何回かかけてみろよ
4821940	4822940	何とかしろ
4822940	4823940	魔法は妊婦さん好きだよ
4823940	4824940	こいつは全国の一才だぞ
4824940	4826940	好きな人に迷惑かけたくない気持ちもあるんだよね
4826940	4827940	何回かかけてみろよ
4827940	4828940	大雨やぞ大丈夫なのか
4828940	4829940	一緒まぜてもらえ
4829940	4830940	W
4830940	4831940	狂いそうか
4831940	4832940	戦えよ
4832940	4833940	最後の値段
4833940	4835940	ママホちゃんと会いたい
4863940	4865940	もうあんなきゃ
4867940	4868940	なかなか
4884940	4886940	もうあんなきゃ
4894940	4895940	痛い
4899940	4900940	好きの声
4923940	4925940	ハイカーマホの友達の地面の配信のURL
4925940	4926940	これ以上逃げて何になるんだよ
4926940	4927940	糸と魔法が囲ってるところ想像して
4927940	4929940	45分からキッツラなキッツラなキッツラ
4929940	4931940	ハイカーマホの友達の地面の配信のURL
4931940	4933940	夜中に部屋で手紋気付けて何してんの
4933940	4934940	会いたいね
4934940	4935940	バカ野郎
4935940	4936940	無理を通して道理を取り取り出すんだよ
4936940	4938940	それは俺たち、妊婦のやり方だろうな
4938940	4939940	声聞きたいね
4939940	4940940	シャイニングだな
4940940	4941940	地面の配信実況して
4941940	4942940	咲いたままで行こう
4942940	4944940	シャイニングだけでギフトさせるなとこね
4944940	4945940	声がけても聞きたいね
4946940	4947940	マリアン以降
4947940	4948940	ギフトいくら稼いだ
4948940	4949940	マホちゃんみたいな女は
4949940	4950940	相手の本気を常に試してるんだよ
4950940	4951940	見せてみろよ
4951940	4952940	お前の本気を
4952940	4953940	ハナダマユ
4953940	4954940	佐藤さんの言葉本気で好きになったの
4954940	4955940	第2効果で
4955940	4956940	地面なら名顔
4956940	4957940	地面行ってみる
4957940	4958940	ローズマリーの赤ちゃん
4958940	4959940	おい、たまには頑張れよ
4959940	4960940	3万以上稼いだ
4960940	4961940	さよなら大好きな人
4961940	4962940	お前はカジオとね
4962940	4964940	サイタマ行って川声デートしようよ
4964940	4965940	顔半端に出してよく分からないから
4965940	4966940	持てないんだろう
4966940	4967940	顔全部出せ
4967940	4968940	もしかして我々寄り起こしてはいけない
4975940	4976940	ハイパーマホちゃん
4976940	4977940	あや行動しろ手遅れになるぞ
4977940	4979940	もう何してんだろうな
5005940	5007940	ハイパーマホちゃん
5030940	5032940	もう一回電話スカイプしてみよう
5035940	5036940	もう寝てるの?
5036940	5037940	もう寝てるの?
5038940	5039940	寝てるの?
5063940	5064940	もう寝てるの?
5064940	5065940	寝てるの?
5067940	5068940	寝てるの?
5081940	5083940	もう時間を考えなさい
5089940	5091940	じゃあ今日ハロワー行かなきゃいけないから
5091940	5092940	もうあるわ
5095940	5097940	ハロワー行かなきゃいけないから終わるわ
5106940	5108940	もうハロワー行きたくないよ
5109940	5112940	もうこんな気持ちでハロワー行きたくないよ
5125940	5127940	ハロワー行きたくないよ
5139940	5141940	ハロワー行きたくない
5143940	5145940	マホちゃんと話したい
5151940	5153940	マホちゃんと話したい
5153940	5154940	あ痛い
5183940	5185940	現在ハイパーマホと通話中
5186940	5188940	ジーメンって人が
5197940	5198940	オープンネック
5213940	5215940	ハイパーマホの友達のジーメン
5215940	5216940	現在はイパーマホと通話中
5216940	5217940	アイに行ける進歩
5217940	5219940	スマホとジトリボを勝手にする配信しろ
5219940	5220940	マホちゃんに嫌われたの
5220940	5221940	ハロワーダメエイネ
5221940	5222940	ハロワーはぶっぱしろよ
5222940	5223940	月曜日ハイトケダブリュー
5223940	5224940	思いの強さよ
5224940	5225940	サイタマ行けば余裕で会えます
5225940	5226940	ハロワーダメエイネ
5226940	5227940	ノンバインに抜いてもらえよ
5227940	5228940	ハイパーマホの友達のジーメン
5228940	5230940	現在はイパーマホと通話中
5231940	5233940	ハロワーダメエイネ
5237940	5238940	ハイパーマホの友達に相談しろよ
5238940	5239940	現在はイパーマホと通話中
5239940	5240940	ココでサイタマ行ける行動力を
5240940	5241940	見せたらお前配信で食えるよ
5241940	5242940	マホちゃんに断られたんだろう
5243940	5244940	ハロワーダメエネ
5244940	5245940	ハロワーダメエネ
5245940	5246940	ノンバインに抜いてもらえるよ
5246940	5247940	マホちゃんアーヂングバイク
5247940	5248940	マホちゃんにアーヂングバイク
5248940	5249940	マホちゃんにアイに行けよ
5249940	5250940	ジーメンのが大事
5250940	5251940	ってことはマホを受けたの
5251940	5252940	ジーメンで行くか
5252940	5253940	マホが落ちたとして
5253940	5254940	ジーメンのところに殴り込め
5254940	5255940	直接アイに行けよ
5255940	5256940	直接愛に行けよ
5256940	5258620	そろそろ障害者の大切いをしなくなるぞ
5258620	5259620	アーマホちゃんマホちゃん
5259620	5261460	つまりジーメントつながればミッションコンプリートだな
5261460	5262340	ジーメンならな
5262340	5263660	ハイパーマホの友達のジーメン
5263660	5264980	現在はイパーマホと通話中
5264980	5265940	マホになりされたん?
5265940	5266780	拒否だれたか?
5266780	5267900	行くのは本当にハロワか
5267900	5269660	移動の家にいるハイパーマホのところじゃないのか
5269660	5270460	ザマウツ
5270460	5271300	ハイパーニンポ
5271300	5272180	僕とおもて
5272180	5273140	愛に行けよいいなぁ
5273180	5276260	ザマウツザマウツザマウツぃザマウツザマウツザマウツザマウツザマウツザマウツザマウツ
5276260	5277140	起きてるんだ
5277140	5278140	またブロッグで来るさ
5278140	5278940	拒否されてるかもな
5278940	5280100	ブロッグさせたか
5280100	5281420	excited正映お前もハイパーマホの友達のジーメン
5281420	5282700	現在はイパーマホと通話中
5282700	5284020	お前がマホうらぎったんだよ
5284020	5284660	そうだな
5284660	5286220	本当にハロワにいかなきゃならないんだろうか
5286220	5286780	すごい
5286780	5287580	友達のジーメン
5287580	5288660	現在はイパーマホと通話中
5288660	5289380	ブロックW
5289380	5291260	マホちゃんのことをハロワに相談に行こう
5291260	5292220	二個性のブロッグを
5292220	5295220	わー
5295220	5296220	あったり前だったら
5296220	5300220	なんか大きな方行けない時間なのにも眠いんだけど
5300220	5301220	家に来て欲しいってことじゃね
5301220	5302220	ブロックされてら
5302220	5303220	糸君に電話してみないか
5303220	5304220	ブロックならかけ放題だな
5304220	5305220	ハローからもブロック
5305220	5306220	ストーカー対決はお前が語られない
5306220	5308220	今行くべきなのはハイバーマグのことがあるぜ
5308220	5310220	糸にかけてみるのは
5310220	5311220	覚醒するか
5311220	5312220	抑えられないことがある
5312220	5313220	なんかすごい言うつだけど
5313220	5314220	焦らされてるんだよ
5314220	5316220	ネガティブに考える愛に来て欲しいから
5316220	5317220	わざとれないくダブル
5317220	5318220	今の二個性で本物はこいつしかいない
5318220	5323220	黄もりんとお前�νどっちの細鳥남
5327220	5328220	ハロマイケ
5328220	5329220	お前マホちゃんにはなんて言われたか思い出せ
5329220	5330220	薬飲んで寝よう
5330220	5332220	水見がマホより大事なの
5332220	5333220	とりあえず家に向かうよ
5333220	5334220	思いに来こ
5336220	5337220	ないで眠いて跳っちゃんかよ
5337220	5339220	呈実は忙しいだろ
5341220	5344220	マホちゃんの好きな ところはもう全然全部好きだよ
5344220	5345220	全部好きだよ
5348220	5351220	マホより睡眠かよ マホちゃんに会いたくないのか
5352220	5355220	んー めちゃくちゃ全部好きだよ
5355220	5357220	ゲームでネカマやってた時こういう奴いたからガチだろうなw
5357220	5360220	気持ち悪いなおさん 村間子は 共用のない言い方
5360220	5362220	気持ち悪いなおさん 愛してると言え
5362220	5364220	お前ちゃくちゃ全然全部好きだよ
5364220	5368220	結構だな思いつかないんだろ 気持ち悪いなおさん 包帳も 全部言ってやれ
5368220	5371220	気持ち悪いなおさん 今動かないならハイパーのTKB動画で45ってね
5371220	5373220	そういうのマジで嬉しいからな ちゃんと好きなとこ言ってやれ
5374220	5378220	顔が可愛くて 性格が優しくて
5380220	5381220	メンヘラで
5384220	5387220	そうするシントが言っちゃってさ
5388220	5390220	飛び寄りとか言っちゃって
5395220	5396220	自分には作って
5403220	5408220	俺みたいなさ 気持ち悪い奴にも優しくしてくれて
5409220	5411220	性格優しいか 気持ち悪いなおさん
5411220	5413220	優しくはない包帳 リステンのw
5426220	5428220	そうそれぐらいかな
5428220	5433220	あと包帳を持って衝撃したりする デンジャラツの
5433220	5435220	そのところも好きだし
5439220	5442220	もうとにかく全部好きだよ
5449220	5455220	あと 車乗って乗ってところも好きだし
5461220	5464220	メンヘラのところも好きだし
5468220	5470220	今まで結局は見た目でしょ
5470220	5472220	残念 移動の女です
5475220	5477220	好きな人ができた
5479220	5483220	好きな人ができたらさ ストーカーするぐらい
5485220	5487220	するところも好きだし
5490220	5492220	まあそうする それくらい好きだよ
5498220	5500220	じゃあ終わります
5502220	5503220	眠いけど
5507220	5509220	そこ幕府系好きだね
5515220	5518220	ハロワイク気分じゃないけど 行かなきゃいけないから
5519220	5521220	ハロワイキマス
5522220	5524220	お疲れさまでした
5528220	5531220	お疲れさまでした
