start	end	text
0	5120	俺さあ彼女ができるなら
6720	12000	ネットネットでしかないと思ってたけど
12920	22920	彼女ができるならねネットでしかないと思ってたけど もうネットもで彼女作るのも無理だ
22920	26440	っていう結論に達した
30160	33440	チーターでのバラ見て迷惑経験に入りますか
33760	42120	何かも打つだから今日1時間度終わるわちょっと 予定もあるし
42320	46240	予定もあるし1時間度終わる
50000	53760	だから もうねー
53760	58560	人間としてに成績だからどこ行っても無理だよ 予定ってアニメだろ1時間じゃなくて先ほどやらないんだろ
58560	65200	今日やらない予定だったけどちょっと予定の前に1時間ぐらい開いたから
65200	71280	まあちょっとちょっとやろうかなと思って今までの総括というかね
71280	74440	まあ振られたね
74600	77880	資料がていらっしゃい
78280	86160	なんかねもうツイッター始めてからねろくなことないわ俺
89520	94480	今回のねあればホントショックだったわ
98520	104640	なんでさー 2回目の成人式ありがとう
104640	109320	あそうだもう2回目の成人式なんだ
111320	116680	2回目の成人式なんだ 忘れてたわ
116800	120480	来月41歳だかい
120480	125520	あ違うわ2回目の成人式は去年だよ
125800	129600	2回目の成人式は去年だよ
130080	133440	俺早生まれだから
134320	138880	だから去年だったんだ2回目の成人式
141440	144600	あ今日去年だわ
144800	150280	今年はもう41歳だから
154280	160880	2回目の成人式去年だったわ忘れてた
161520	168920	毎年毎年終わったも もう絡むことはないよ
169680	173760	ハイパーがオーディーでぶっ倒れた
174760	181160	まあまあ僕あんまり関わらない方がいいと思うその件については
181160	187320	初戦ねー 一度スカイプで話しただけの中だし
187320	191320	中だだけだし
192320	201040	まあなんかそこらへんのかかわいとはかかわりかかわらないほうがいいなと思った
206840	209320	おはよう
213400	218600	まあでもネットでもう彼の図でできないスター
221320	228800	もうどうどうしよう こんなんじゃさ働いてもさモチベーション上がってないわ
234800	242320	マイちゃんはさ 俺のこと好きだと勘違いしてた
243320	252520	エムさんは僕のことを男として好きだと勘違いしてた
253400	256160	それで
258120	266720	告白したら なんかすごい怒られためちゃくちゃ
267360	276920	山井ちゃんのツイッター見れないよフォローしてないから ブロックしたから
276920	283080	まあどう思わないよ そうだね
283960	289320	まあ結局 彼女が終了したとしても彼女と音楽いかなくなったら会社やめるんだろうな
289320	294200	結局日本には彼女はまだ早かったや
295200	303640	日本の恋愛スキルなんて小学生と一緒だよ
303640	310880	小学生の男の子が好きな子についつい意地悪して嫌われるって言うよね
310880	316400	そっから抜けで出てないわ
316400	319920	いいかいことがあるならdmで言ってください 私とでも悔しいよ
319920	328600	映画の専門みてもあの男のママママイさんにそこまで言わせてしまったって言うのがね情けないよ
331040	340160	まあ就職 包帳付き付けられるぐらいじゃ分かれない
341160	343160	ん
346000	353000	恋愛映画で参考になるのも敵かな劇場版も敵
353000	356760	劇場版も敵がで
357760	363640	劇場版も敵でも森山未来に
363640	371080	長さまさみが口を通しで水を飲ませるところがすごく良かった
371080	378600	あと長さまさみが天下のティーシャツ来て どやってやるところ
378600	381560	そこは良かった
382560	384560	えっ
385400	395800	包帳付き付けられるほど愛されたいそうだね それぐらい愛されて刺されたらもうそれは本物だよ
399560	403720	いや親方は無理です
404720	411400	劇場版も敵は結構面白いからね みんなも見た方がいいよあれは
412560	414560	あ
415200	421040	もてきはテレビも見てたしね面白かった
421040	426400	えっ千葉給付金決まったのいくら
426400	429560	ちょっと調べる
429560	432200	給付金
432200	435200	千葉
435800	442200	持った知事
442200	446200	飲食店への協力金じゃん
446200	449720	給付金なんて出ないじゃん
449880	456360	森田検査クアさあ最後にさあ 給付金出せような
456360	459600	千葉県民善員に
460600	467600	給付金さあ10万ぐらい出せような 森田検査クー
467600	477600	今まで何もやって来なかったんだからせめて最後にさあ 県民にさあ幸せになるようなことしろよな
477600	482600	日本女一切のマグロ男
482600	486600	いやマグロではないよ多分
489600	493600	俺が主導権を握るから
500600	510600	主導権を握るタイプだからこんな俺がベッドに青向け入れてよろしくお願いしますって言って
510600	514600	そんなさマグロじゃないから
519600	522600	主導権なんて握れると思ってるの
526600	532600	俺勉強したからね2人エッチっていう漫画で
535600	543600	2人エッチっていうマンマンガでいろいろ勉強したから
544600	551600	だからイメージトレーニングはできてるよ
555600	557600	2人エッチって知ってる?
557600	563600	同邸と少々少女で結婚したカップルがどんどん
563600	573600	そのエッチのスキルをあげていくためにいろいろ挑戦するっていうねそういうマンガ
577600	581600	それで俺勉強したからね2人エッチで
582600	589600	まぁ2人エッチみたいなのが理想だね
589600	599600	DTとSJで結婚して2人でスキルを高め合っていくっていう
603600	605600	それが理想だね
606600	614600	女の人がすごいテクニックがあったら
614600	619600	歴代の男に仕込まれてきたんだろうなと思って
619600	624600	ちょっとねテンション下がるかもしれない
625600	633600	このテクニックはどんな男に仕込まれたんだろうなとか考えると
633600	637600	ちょっとテンション下がるよ
654600	661600	最初はマグロ同士だけどなんとか2人で頑張るんで
661600	664600	ちゃんと
672600	677600	前の話はもうしないわ
677600	682600	前の話はもうしない
682600	686600	そう探り合いだね
695600	700600	もうねターゲットとかいないから
700600	704600	俺はリアルで彼女を作るわ
704600	714600	就職して就職してジムで就職してジムってさ女の人いっぱいいるじゃん
714600	722600	その女の人の中からなんかいい人がいたら思い切って
722600	729600	今度一緒に食事でもしませんかって声かけて
735600	742600	なんかねもうそれしかない気がしてきた
742600	747600	もうネットでさ彼女できる気がしないんだけど
751600	756600	なんかもうネットで彼女ができる気がしない
756600	759600	2回も失敗してさ
764600	773600	今度の手段で俺が事務職を目指して就職活動するのか
773600	788600	それとももっと別の俺にあったところが
788600	793600	見つかるのかわかんないけど
793600	797600	まあそうそれで決まるね
800600	804600	仕事より女のことばかり考えてる
804600	812600	だってさ正直さ俺がつける仕事なんてさ最低賃金だしさ
812600	819600	最低賃金だしもう自己実現の欲求は満たされないじゃん
819600	829600	だから彼女でもできて自己実現の欲求を満たしたい
829600	838600	自己実現の欲求を満たしたい彼女でも作って
838600	841600	仕事がね
842600	845600	10位に
845600	852600	ハイパー魔法ちゃんとはねなんかかかわらない方がいい気がしてきた
852600	860600	まあこの前のさ自殺するって言ってたからすごい気になって
860600	869600	まあ就労支援遅刻してまでスカイプかけ続けたけど
869600	873600	今死にかけてる
873600	884600	でもハイパー魔法ちゃんみたいな子はさ忍法じゃ満足できないと思うよ
884600	894600	ハイパー魔法ちゃんみたいな子はね忍法じゃ満足できないと思う
894600	897600	忍法みたいな
897600	907600	一度も彼女ができたことのないdTのおっさんじゃあ満足できないと思う
907600	909600	同じことにどういうの気持ち悪いよ
909600	911600	ハイパー魔法ちゃんを知ってよ
911600	914600	今年就職活動しても働いてるやついるんだよ
914600	919600	なんでそういう事だけ聞くんだお前にわかんねーわ
920600	929600	俺は泣きするタイプじゃないかなんで
929600	934600	僕が彼女ができたらもうその子に尽くすよ
934600	937600	もうその子の幸せを一番願って
937600	941600	もうその子に尽くすよ
941600	945600	泣きするタイプじゃないよ俺は
950600	955600	泣きするタイプではない
955600	960600	そうだね
960600	964600	泣きするやつってどういう心境なんだろうね
964600	969600	せっかくさ自分のことを好きでいてくれる彼女がいるのに
969600	973600	それだけで幸せじゃん
973600	975600	それって幸せなことじゃん
975600	980600	その幸せを自らドブにしてるようなことをするってさ
980600	983600	ちょっとね同じ男としてね
983600	993600	泣きする男の心境というのがよくわからない
993600	999600	糸は泣きしてない
999600	1006600	何にせよね大事にするよ俺はもし彼女ができたら
1013600	1024600	でもね俺一つだけ女性の修正で我慢できないことが
1025600	1029600	それはヒステリーを起こして
1029600	1034600	ヒステリーを起こす女
1034600	1037600	ヒステリーを起こす女が
1037600	1045600	だけは我慢できない
1045600	1051600	ヒステリーを起こして
1051600	1055600	なんかさちょっとしたことでさ
1055600	1058600	被害者意識を持ってさ
1063600	1068600	なんで私のこと放送で話すのとかさ
1068600	1073600	そういうヒステリーを起こす女の子はちょっと無理だね
1082600	1087600	ヒステリーって言えばね
1087600	1094600	俺がアニメーター時代のジムの女
1094600	1100600	ジムの女がヒステリーを起こして
1100600	1106600	俺にこういう目もゴミ箱に貼られた
1106600	1110600	ゴミ箱はいっぱいまで入れてください
1110600	1113600	ゴミ箱はただじゃないんですっていうね
1113600	1116600	文字でヒステリーを起こされた
1116600	1119600	それもヒステリーだよ
1123600	1129600	だからね感情があんまり上下しない子がいい
1129600	1134600	仏様とか仏様とかね
1135600	1141600	ヒステリーを起こす人は聞き嫌いですね
1141600	1145600	正直
1152600	1155600	前とはね
1155600	1160600	この先許したとしてもまた同じことの繰り返しになるから
1160600	1164600	マイちゃんとはもう関わらないわ俺
1171600	1175600	まあいろいろ警察とかにも相談してるよ
1175600	1180600	結構嫌がらせとかあるからね
1180600	1185600	放送では詳しく言わないけど
1185600	1189600	今警察も入ってね動いてるから
1192600	1198600	オススメのミステリー小説はアガサクリスティンのアクロイド殺人事件
1203600	1208600	アクロイド殺人事件っていう小説がすごい面白かった
1216600	1223600	女性の感情の寄附を理解できないのが付き合えないと思う
1223600	1225600	そうな
1231600	1234600	女性の感情の寄附か
1234600	1238600	そういうのを男は受け止めなきゃいけないの
1239600	1241600	警察が動いてるって
1243600	1245600	そういうのを
1245600	1247600	妖の男はみんな
1247600	1249600	女性の感情の寄附を理解できないのが付き合えないと思う
1249600	1251600	その寄附を理解してあげて
1251600	1254600	ああそういう感情なんだね
1254600	1256600	よしよしみたいなさ
1256600	1258600	そういうさ
1258600	1262600	そういう心つもりでいなきゃいけないの
1269600	1274600	そういう心つもりでいなきゃいけないのか
1286600	1290600	ハイパーマホをオーディーして病院に運び込まれた
1299600	1301600	警察が動いてるって言うほどだよな
1301600	1303600	だから女性という問題じゃない
1303600	1305600	21歳女です
1305600	1308600	DMを送ったので放送終わったら確認お願いします
1314600	1317600	DMなんて来てないんですけど
1317600	1319600	DMを送ったので放送終わったら確認お願いします
1319600	1321600	警察に従うしかおで残ったのかかおもしは
1321600	1323600	臨房精神のおすり飲んでるから理解できるんじゃないの
1323600	1326600	例えば女がからDM来ても
1326600	1328600	これはすぐ疑う
1328600	1330600	これはつつりだと
1333600	1335600	これはつりだって
1335600	1337600	まず疑う
1346600	1349600	今日はあと30分くらいしたら終わるわ
1350600	1353600	あと30分くらいで終わるわ
1364600	1366600	まあ理想としてはね
1368600	1373600	働いてる女性でそこそこ練習があって
1374600	1377600	それで俺は練習100万くらいしか
1377600	1379600	稼げないでしょ
1379600	1382600	それでも私が稼ぐから
1382600	1385600	あなたはそんな無理しないでいいのよって
1385600	1387600	言ってくれる
1387600	1389600	そういう女性と結婚する
1394600	1396600	お金なら私が稼ぐから
1396600	1399600	あなたはもっとゆっくり
1399600	1401600	仕事も
1402600	1405600	ゆっくり仕事しなさいって
1407600	1410600	そういうパターンでしか結婚できないと思う
1412600	1414600	そういう人いないかな
1418600	1420600	そういう人がいたら
1420600	1423600	俺は喜んで結婚するよ
1431600	1433600	なんかそのパターンしかないね
1439600	1441600	親方は金がないじゃん
1442600	1444600	親方無職なんだし
1448600	1454600	あそう 芸人を支える女のことがいるよね
1454600	1456600	貧乏芸人を
1456600	1458600	もう練習さあ
1458600	1461600	10000円くらいの貧乏芸人を
1461600	1464600	支えてくれる女の人とかいるよね
1469600	1472600	なんか男を支えたいって思ってくれる
1472600	1474600	女も一定数いるよね
1475600	1478600	そういう女の人も一定数いる
1481600	1483600	まあ
1483600	1485600	おしょうもないというか
1485600	1487600	まあ
1492600	1494600	まあ
1494600	1496600	うだつの上がらない男に
1497600	1499600	親方は金持ち
1499600	1501600	親方を支えてくれる女の子
1514600	1516600	看護師とかいいんだ
1517600	1519600	今日はうつだよはっきり言って
1527600	1529600	俺もさあ
1529600	1531600	ニコ生で人気物になって
1531600	1533600	月
1533600	1537600	月30万くらい稼げるようになるかもしれないじゃん
1539600	1542600	ニコ生の人として成功するかもしれないし
1544600	1546600	ギフトのバンバン飛んでさ
1550600	1552600	今日はうつだよ
1557600	1559600	うつじゃねえよお前
1561600	1563600	ホストか
1563600	1565600	確かにホストとか
1566600	1568600	ホストとかあれだよね
1579600	1581600	ホストか
1583600	1585600	はいおはよう
1587600	1589600	いや今度はねもう
1590600	1592600	生主とか実装とか
1593600	1595600	そういうのはもういいわ
1598600	1600600	あと俺が
1600600	1602600	好きになったとして
1602600	1604600	それでニコ生で話題に出すでしょ
1604600	1606600	Twitterでも絡むでしょ
1607600	1609600	それで
1609600	1611600	その子のところになんか
1611600	1614600	嫌がらせDMとか行くかもしれないよ
1615600	1618600	それでも別に気にしないっていう
1619600	1621600	女の子が
1621600	1624600	それでも気にしないっていう女の子が
1624600	1626600	いたら
1626600	1628600	月会いたよ
1645600	1647600	なんかさ
1647600	1649600	俺に話題に出されて
1649600	1652600	嫌がらせのDMが来たからって
1654600	1658600	なんで私のこと話題に出すのとかさ
1658600	1660600	そういうことを言わないで
1660600	1663600	また変なDM来たね
1663600	1665600	来たなって言って
1666600	1669600	ブロックして平然として入れられる女性
1674600	1676600	また変なDM来たわね
1676600	1678600	と思って
1678600	1680600	そっとブロックして
1683600	1685600	そういう
1685600	1687600	心のゆとりを持った女性と
1688600	1690600	月会いたいわ
1694600	1696600	そういう
1696600	1698600	そういうことを
1705600	1707600	まあいい飯じゃないけど
1720600	1722600	でもさ
1722600	1726600	MさんにどんなさDMが来たか分かんないけど
1727600	1729600	そうやって人法が悪いの
1729600	1731600	悪いの
1732600	1734600	そんなDMが来たってさ
1735600	1737600	いちいち気にしないでさ
1737600	1739600	普通にブロックすればいいじゃん
1741600	1743600	そういうやつをブロックすればいいじゃん
1743600	1745600	それで進む話なんじゃないの
1747600	1749600	なんで人法がさそれでさ
1749600	1751600	怒られるの
1759600	1761600	これしか思いやからね
1775600	1777600	まあ話題にしないけど
1777600	1779600	例えばの話だよ
1782600	1784600	例えばの話ですよ
1790600	1793600	放送始めたての女んな話は
1793600	1795600	コラ画像とか作られるから
1795600	1797600	すごい怖いらしい
1797600	1799600	ああ
1799600	1801600	そうかそういう生むのもあるのか
1805600	1807600	そういうさ
1807600	1809600	DM送れやつって何考えてんだろうね
1810600	1812600	普通にそれ犯罪じゃん
1815600	1817600	人にさ
1817600	1819600	挨拶画像を作って
1819600	1821600	送るのって犯罪じゃないの
1823600	1825600	それって警察に行くべきだよね
1826600	1828600	こういう嫌がらせDMが
1828600	1830600	来ましたって
1831600	1833600	そのうちにあきられるね
1833600	1835600	何考えてるってあんたが見ないよ
1835600	1837600	外接文書もあるんだぞ
1837600	1839600	人法は人法だな顔もしない
1839600	1841600	それとも同じ
1841600	1843600	大事なことなので2回お前って
1843600	1845600	引っ込もりのまちろんって感じだな
1845600	1847600	妄想クセットが官的な支配されて
1847600	1849600	都合の悪いこと全部無視して
1849600	1851600	本当に人として終わってるな
1851600	1853600	人法顔出して女性の話を作れよ
1853600	1855600	外接ポイント送る人
1855600	1857600	綺麗なブーメランキー
1857600	1859600	送るの?
1859600	1861600	ちょっと気になるんだけど
1861600	1863600	親方にはさすがに来ないか
1863600	1865600	セクハラDMとか
1865600	1867600	嫌がらせDMとか
1871600	1873600	親方には来ないか
1873600	1875600	親方は無理とか言ってた
1875600	1877600	親方批判された
1885600	1887600	さすがに来ないって
1889600	1891600	親方にセクハラDMとか
1891600	1893600	そういうのは
1893600	1895600	きそうなイメージがないからさ
1895600	1897600	親方には来ないから
1897600	1899600	さすがに来ないって
1899600	1901600	そういうところだぞ
1901600	1903600	そういうDMが来て
1903600	1905600	女性は減らってしまう
1905600	1907600	っていうね
1907600	1909600	セクハラDMならアウトだと思ってる
1909600	1911600	セクハラで通報します
1911600	1913600	親方は絶対のビジュアル
1913600	1915600	デリカシーのない奴らは
1915600	1917600	それは失礼だろ
1917600	1919600	親方はデジェンド
1919600	1921600	食事に行きませんかとか
1921600	1923600	その程度なんだ
1923600	1925600	女性種の彼女作れよ
1925600	1927600	人口さんが信仰なだけなんです
1927600	1929600	食事に行きませんかとかくるよ
1929600	1931600	人口を被警察に来ると
1931600	1933600	顔も知らない
1933600	1935600	まさに今のコメントが出くなら
1935600	1937600	そのものですねW
1937600	1939600	嫌ってんのお前だろ
1939600	1941600	親方通報しとけ
1941600	1943600	親方と人口は言いたいことを言い合う中だから
1943600	1945600	つまりお前のクソリプは悪意があったってことか
1945600	1947600	親方に失礼なこというような
1947600	1949600	クソリプは悪意はない
1949600	1951600	全員というか
1951600	1953600	ネタも
1953600	1955600	ネタもちょっと混じってるけど
1955600	1957600	だいたい
1957600	1959600	ここの人と
1959600	1961600	付き合いたいなと思う人しか
1963600	1965600	DMは
1965600	1967600	DMじゃないリプは送らないよ
1971600	1973600	この人と付き合いたいなってね
1973600	1975600	思った人しか
1975600	1977600	リプは
1981600	1983600	恋愛感情イコール
1983600	1985600	性欲
1985600	1987600	広い気が
1987600	1989600	言ってたからなんでそれが
1989600	1991600	正しいことになるの
1991600	1993600	性欲じゃないよ
1997600	1999600	恋愛感情は
2005600	2007600	元は
2007600	2009600	性欲と一緒だったかもしれない
2009600	2011600	原始人とか
2013600	2015600	でも
2015600	2017600	ここいってさ
2017600	2019600	性欲がさ
2019600	2021600	まだない幼稚園
2021600	2023600	幼稚園くらいの頃から
2023600	2025600	好きな女のことが
2025600	2027600	できたりするでしょ
2027600	2029600	それはさ
2029600	2031600	性欲じゃないでしょ
2031600	2033600	幼稚園くらいの頃
2033600	2035600	好きな女のことが
2035600	2037600	いなかったみんな
2041600	2043600	まあマホちゃんの顔も
2043600	2045600	知らせに見送ったの
2045600	2047600	まああれだけど
2051600	2053600	だって
2053600	2055600	幼稚園性に
2055600	2057600	性欲なんてないでしょ
2057600	2059600	それなのに幼稚園自でも
2059600	2061600	好きな女のことが
2061600	2063600	できるでしょ
2063600	2065600	俺も
2065600	2067600	幼稚園の頃
2067600	2069600	Sちゃんっていう子が好きで
2069600	2071600	その子を追っかけ回してて
2071600	2073600	そうやってその子はキャーキャーキャー
2073600	2075600	とか言って逃げるのそれで俺が
2075600	2077600	待てって言って追っかけるの
2079600	2081600	それが楽しくて
2081600	2083600	仕方がなかった
2085600	2087600	だから今は思えば
2087600	2089600	それが
2089600	2091600	恋だったのかなって
2091600	2093600	思った
2097600	2099600	俺が追っかけるとキャーって
2099600	2101600	逃げて
2103600	2105600	そういうことをしてた
2115600	2117600	幼稚園の頃
2117600	2119600	でもその子も別に
2119600	2121600	本気で嫌がってるわけじゃなくて
2121600	2123600	すごい楽しそうな感じで
2123600	2125600	こうやってさ
2127600	2129600	逃げてキャーキャーやって
2129600	2131600	逃げて振り向いて
2131600	2133600	こうやって手を叩いて
2133600	2135600	こっちだよみたいな感じで
2137600	2139600	まあ鬼ごっこみたいなもんだね
2139600	2141600	幼稚園の話です
2169600	2171600	だって
2183600	2185600	幼稚園の頃でも恋愛感情とか
2185600	2187600	あったよね
2187600	2189600	この子が好きで
2189600	2191600	この子はあんま好きじゃない
2191600	2193600	この子はなんとも思ってないとか
2193600	2195600	そういうさ区別ってつけてたでしょ
2195600	2197600	幼稚園じ
2211600	2213600	いやあいらっしゃい
2225600	2227600	全てにおいて
2227600	2229600	お前に勝ってる自信あるってさ
2229600	2231600	お前映画5000本見たのかよ
2231600	2233600	映画5000本見てから
2233600	2235600	そういうこと言えよ
2237600	2239600	映画5000本見てから
2239600	2241600	そういうこと言えよ
2255600	2257600	映画5000本も見てないのに
2257600	2259600	全てにおいて勝ってるとかさ
2261600	2263600	言うもんじゃないよ
2267600	2269600	映画5000本見て共用
2269600	2271600	見つけてから
2271600	2273600	俺にマウントを取れよ
2285600	2287600	映画5000本が自慢ワールドワイドウェブタンに
2287600	2289600	決まらなかっただけだろうが
2289600	2291600	映画官
2291600	2293600	5000本全部言ってくれますから
2293600	2295600	かなマウント映画
2295600	2297600	覚えてるのは50本
2297600	2299600	何の役にも立たなかったのだろう
2299600	2301600	映画5000本でマウントを取る40歳
2301600	2303600	5000見てから言えよ
2303600	2305600	映画マウントサイト
2305600	2307600	お前が5000本見た証拠
2307600	2309600	映画5000本見て共用
2309600	2311600	見につけてから
2311600	2313600	俺にマウントを取れよ
2313600	2315600	はいすいませんでした
2315600	2317600	僕が
2317600	2319600	僕があなたに摩擦ってるところは
